,Movie Name,Year of Release,Watch Time,Movie Rating,Metascore of movie,Certificate,Votes,Gross,Description,Director,Stars
742,The Lady Vanishes,(1938),96 min,7.8,98        ,****,"50,609",%^%^%^,"While travelling in continental Europe, a rich young playgirl realizes that an elderly lady seems to have disappeared from the train.",Alfred Hitchcock,"['Margaret Lockwood', 'Michael Redgrave', 'Paul Lukas', 'May Whitty']"
743,Bride of Frankenstein,(1935),75 min,7.8,95        ,****,"46,582",$4.36M,"Mary Shelley reveals the main characters of her novel survived: Dr. Frankenstein, goaded by an even madder scientist, builds his monster a mate.",James Whale,"['Boris Karloff', 'Elsa Lanchester', 'Colin Clive', 'Valerie Hobson']"
744,Duck Soup,(1933),69 min,7.8,93        ,****,"59,016",%^%^%^,"Rufus T. Firefly is named the dictator of bankrupt Freedonia and declares war on neighboring Sylvania over the love of his wealthy backer Mrs. Teasdale, contending with two inept spies who can't seem to keep straight which side they're on.",Leo McCarey,"['Groucho Marx', 'Harpo Marx', 'Chico Marx', 'Zeppo Marx']"
745,Scarface,(1932),93 min,7.8,87        ,****,"27,056",%^%^%^,"An ambitious and nearly insane violent gangster climbs the ladder of success in the mob, but his weaknesses prove to be his downfall.","Directors:Howard Hawks, Richard Rosson","['Paul Muni', 'Ann Dvorak', 'Karen Morley', 'Osgood Perkins']"
746,Frankenstein,(1931),70 min,7.8,91        ,A,"69,664",%^%^%^,Dr. Frankenstein dares to tamper with life and death by creating a human monster out of lifeless body parts.,James Whale,"['Colin Clive', 'Mae Clarke', 'Boris Karloff', 'John Boles']"
747,The Mitchells vs the Machines,(2021),113 min,7.7,80        ,13,"79,581",%^%^%^,"A quirky, dysfunctional family's road trip is upended when they find themselves in the middle of the robot apocalypse and suddenly become humanity's unlikeliest last hope.","Directors:Michael Rianda, Jeff Rowe","['Abbi Jacobson', 'Danny McBride', 'Maya Rudolph', 'Michael Rianda']"
748,Roma,(2018),135 min,7.7,96        ,16,"150,058",%^%^%^,A year in the life of a middle-class family's maid in Mexico City in the early 1970s.,Alfonso Cuarón,"['Yalitza Aparicio', 'Marina de Tavira', 'Diego Cortina Autrey', 'Carlos Peralta']"
749,God's Own Country,(2017),104 min,7.7,85        ,****,"28,548",$0.34M,"Spring. Yorkshire. Young farmer Johnny Saxby numbs his daily frustrations with binge drinking and casual sex, until the arrival of a Romanian migrant worker for lambing season ignites an intense relationship that sets Johnny on a new path.",Francis Lee,"[""Josh O'Connor"", 'Alec Secareanu', 'Gemma Jones', 'Ian Hart']"
750,Deadpool 2,(2018),119 min,7.7,66        ,R,"527,650",$324.59M,"Foul-mouthed mutant mercenary Wade Wilson (a.k.a. Deadpool) assembles a team of fellow mutant rogues to protect a young boy with supernatural abilities from the brutal, time-traveling cyborg Cable.",David Leitch,"['Ryan Reynolds', 'Josh Brolin', 'Morena Baccarin', 'Julian Dennison']"
751,Wind River,(2017),107 min,7.7,73        ,R,"228,673",$33.80M,A veteran hunter helps an FBI agent investigate the murder of a young woman on a Wyoming Native American reservation.,Taylor Sheridan,"['Elizabeth Olsen', 'Jeremy Renner', 'Graham Greene', 'Kelsey Asbille']"
752,Forushande,(2016),124 min,7.7,85        ,UA,"56,961",$2.40M,"While both participating in a production of ""Death of a Salesman,"" a teacher's wife is assaulted in her new home, which leaves him determined to find the perpetrator over his wife's traumatized objections.",Asghar Farhadi,"['Shahab Hosseini', 'Taraneh Alidoosti', 'Mina Sadati', 'Babak Karimi']"
753,Get Out,(I) (2017),104 min,7.7,85        ,15+,"539,288",$176.04M,"A young African-American visits his white girlfriend's parents for the weekend, where his simmering uneasiness about their reception of him eventually reaches a boiling point.",Jordan Peele,"['Daniel Kaluuya', 'Allison Williams', 'Bradley Whitford', 'Catherine Keener']"
754,Mission: Impossible - Fallout,(2018),147 min,7.7,86        ,U/A,"311,262",$220.16M,"Ethan Hunt and his IMF team, along with some familiar allies, race against time after a mission gone wrong.",Christopher McQuarrie,"['Tom Cruise', 'Henry Cavill', 'Ving Rhames', 'Simon Pegg']"
755,En man som heter Ove,(2015),116 min,7.7,70        ,PG-13,"51,477",$3.36M,"Ove, an ill-tempered, isolated retiree who spends his days enforcing block association rules and visiting his wife's grave, has finally given up on life just as an unlikely friendship develops with his boisterous new neighbors.",Hannes Holm,"['Rolf Lassgård', 'Bahar Pars', 'Filip Berg', 'Ida Engvoll']"
756,What We Do in the Shadows,(2014),86 min,7.7,76        ,R,"171,766",$3.33M,"Viago, Deacon, and Vladislav are vampires who are struggling with the mundane aspects of modern life, like paying rent, keeping up with the chore wheel, trying to get into nightclubs, and overcoming flatmate conflicts.","Directors:Jemaine Clement, Taika Waititi","['Jemaine Clement', 'Taika Waititi', 'Cori Gonzalez-Macuer', 'Jonny Brugh']"
757,Omoide no Mânî,(2014),103 min,7.7,72        ,U,"37,138",$0.77M,"Due to 12 y.o. Anna's asthma, she's sent to stay with relatives of her guardian in the Japanese countryside. She likes to be alone, sketching. She befriends Marnie. Who is the mysterious, blonde Marnie.",Hiromasa Yonebayashi,"['Sara Takatsuki', 'Kasumi Arimura', 'Nanako Matsushima', 'Susumu Terajima']"
758,The Theory of Everything,(2014),123 min,7.7,71        ,U,"427,845",$35.89M,A look at the relationship between the famous physicist Stephen Hawking and his wife.,James Marsh,"['Eddie Redmayne', 'Felicity Jones', 'Tom Prior', 'Sophie Perry']"
759,Kingsman: The Secret Service,(2014),129 min,7.7,60        ,A,"622,910",$128.26M,"A spy organisation recruits a promising street kid into the agency's training program, while a global threat emerges from a twisted tech genius.",Matthew Vaughn,"['Colin Firth', 'Taron Egerton', 'Samuel L. Jackson', 'Michael Caine']"
760,The Fault in Our Stars,(2014),126 min,7.7,69        ,UA,"360,177",$124.87M,Two teenage cancer patients begin a life-affirming journey to visit a reclusive author in Amsterdam.,Josh Boone,"['Shailene Woodley', 'Ansel Elgort', 'Nat Wolff', 'Laura Dern']"
761,Me and Earl and the Dying Girl,(2015),105 min,7.7,74        ,PG-13,"128,010",$6.74M,"High schooler Greg, who spends most of his time making parodies of classic movies with his co-worker Earl, finds his outlook forever altered after befriending a classmate who has just been diagnosed with cancer.",Alfonso Gomez-Rejon,"['Thomas Mann', 'RJ Cyler', 'Olivia Cooke', 'Nick Offerman']"
762,Birdman or (The Unexpected Virtue of Ignorance),(2014),119 min,7.7,87        ,A,"605,510",$42.34M,"A washed-up superhero actor attempts to revive his fading career by writing, directing, and starring in a Broadway production.",Alejandro G. Iñárritu,"['Michael Keaton', 'Zach Galifianakis', 'Edward Norton', 'Andrea Riseborough']"
763,Le passé,(2013),130 min,7.7,85        ,PG-13,"47,654",$1.33M,"An Iranian man deserts his French wife and her two children to return to his homeland. Meanwhile, his wife starts up a new relationship, a reality her husband confronts upon his wife's request for a divorce.",Asghar Farhadi,"['Bérénice Bejo', 'Tahar Rahim', 'Ali Mosaffa', 'Pauline Burlet']"
764,La vie d'Adèle,(2013),180 min,7.7,89        ,A,"145,898",$2.20M,"Adèle's life is changed when she meets Emma, a young woman with blue hair, who will allow her to discover desire and to assert herself as a woman and as an adult. In front of others, Adèle grows, seeks herself, loses herself, and ultimately finds herself through love and loss.",Abdellatif Kechiche,"['Léa Seydoux', 'Adèle Exarchopoulos', 'Salim Kechiouche', 'Aurélien Recoing']"
765,The Broken Circle Breakdown,(2012),111 min,7.7,70        ,****,"40,537",$0.18M,"Elise and Didier fall in love at first sight, in spite of their differences. He talks, she listens. He's a romantic atheist, she's a religious realist. When their daughter becomes seriously ill, their love is put on trial.",Felix van Groeningen,"['Veerle Baetens', 'Johan Heldenbergh', 'Nell Cattrysse', 'Geert Van Rampelberg']"
766,Toy Story 4,(2019),100 min,7.7,84        ,U,"226,836",$434.04M,"When a new toy called ""Forky"" joins Woody and the gang, a road trip alongside old and new friends reveals how big the world can be for a toy.",Josh Cooley,"['Tom Hanks', 'Tim Allen', 'Annie Potts', 'Tony Hale']"
767,Captain America: The Winter Soldier,(2014),136 min,7.7,70        ,UA,"786,991",$259.77M,"As Steve Rogers struggles to embrace his role in the modern world, he teams up with a fellow Avenger and S.H.I.E.L.D agent, Black Widow, to battle a new threat from history: an assassin known as the Winter Soldier.","Directors:Anthony Russo, Joe Russo","['Chris Evans', 'Samuel L. Jackson', 'Scarlett Johansson', 'Robert Redford']"
768,Rockstar,(2011),159 min,7.7,****,UA,"42,460",$0.99M,"Janardhan Jakhar chases his dreams of becoming a big Rock star, during which he falls in love with Heer.",Imtiaz Ali,"['Ranbir Kapoor', 'Nargis Fakhri', 'Shammi Kapoor', 'Kumud Mishra']"
769,Nebraska,(2013),115 min,7.7,87        ,UA,"115,788",$17.65M,"An aging, booze-addled father makes the trip from Montana to Nebraska with his estranged son in order to claim a million-dollar Mega Sweepstakes Marketing prize.",Alexander Payne,"['Bruce Dern', 'Will Forte', 'June Squibb', 'Bob Odenkirk']"
770,Wreck-It Ralph,(2012),101 min,7.7,72        ,U,"399,805",$189.42M,"A video game villain wants to be a hero and sets out to fulfill his dream, but his quest brings havoc to the whole arcade where he lives.",Rich Moore,"['John C. Reilly', 'Jack McBrayer', 'Jane Lynch', 'Sarah Silverman']"
771,Le Petit Prince,(2015),108 min,7.7,70        ,PG,"59,815",$1.34M,"A little girl lives in a very grown-up world with her mother, who tries to prepare her for it. Her neighbor, the Aviator, introduces the girl to an extraordinary world where anything is possible, the world of the Little Prince.",Mark Osborne,"['Jeff Bridges', 'Mackenzie Foy', 'Rachel McAdams', 'Marion Cotillard']"
772,Detachment,(2011),98 min,7.7,52        ,****,"81,515",$0.07M,A substitute teacher who drifts from classroom to classroom finds a connection to the students and teachers during his latest assignment.,Tony Kaye,"['Adrien Brody', 'Christina Hendricks', 'Marcia Gay Harden', 'Lucy Liu']"
773,Midnight in Paris,(2011),94 min,7.7,81        ,PG-13,"406,114",$56.82M,"While on a trip to Paris with his fiancée's family, a nostalgic screenwriter finds himself mysteriously going back to the 1920s every day at midnight.",Woody Allen,"['Owen Wilson', 'Rachel McAdams', 'Kathy Bates', 'Kurt Fuller']"
774,Kokuhaku,(2010),106 min,7.7,****,****,"37,736",%^%^%^,A psychological thriller of a grieving mother turned cold-blooded avenger with a twisty master plan to pay back those who were responsible for her daughter's death.,Tetsuya Nakashima,"['Takako Matsu', 'Yoshino Kimura', 'Masaki Okada', 'Yukito Nishii']"
775,The Lego Movie,(2014),100 min,7.7,83        ,U,"337,632",$257.76M,"An ordinary LEGO construction worker, thought to be the prophesied as ""special"", is recruited to join a quest to stop an evil tyrant from gluing the LEGO universe into eternal stasis.","Directors:Christopher Miller, Phil Lord","['Chris Pratt', 'Will Ferrell', 'Elizabeth Banks', 'Will Arnett']"
776,Gravity,(2013),91 min,7.7,96        ,UA,"796,965",$274.09M,Two astronauts work together to survive after an accident leaves them stranded in space.,Alfonso Cuarón,"['Sandra Bullock', 'George Clooney', 'Ed Harris', 'Orto Ignatiussen']"
777,Star Trek Into Darkness,(2013),132 min,7.7,72        ,UA,"474,225",$228.78M,"After the crew of the Enterprise find an unstoppable force of terror from within their own organization, Captain Kirk leads a manhunt to a war-zone world to capture a one-man weapon of mass destruction.",J.J. Abrams,"['Chris Pine', 'Zachary Quinto', 'Zoe Saldana', 'Benedict Cumberbatch']"
778,Beasts of No Nation,(2015),137 min,7.7,79        ,****,"78,406",$0.08M,"A drama based on the experiences of Agu, a child soldier fighting in the civil war of an unnamed African country.",Cary Joji Fukunaga,"['Abraham Attah', 'Emmanuel Affadzi', 'Ricky Adelayitor', 'Andrew Adote']"
779,The Social Network,(2010),120 min,7.7,95        ,UA,"661,323",$96.96M,"As Harvard student Mark Zuckerberg creates the social networking site that would become known as Facebook, he is sued by the twins who claimed he stole their idea, and by the co-founder who was later squeezed out of the business.",David Fincher,"['Jesse Eisenberg', 'Andrew Garfield', 'Justin Timberlake', 'Rooney Mara']"
780,X: First Class,(2011),131 min,7.7,65        ,UA,"667,118",$146.41M,"In the 1960s, superpowered humans Charles Xavier and Erik Lensherr work together to find others like them, but Erik's vengeful pursuit of an ambitious mutant who ruined his life causes a schism to divide them.",Matthew Vaughn,"['James McAvoy', 'Michael Fassbender', 'Jennifer Lawrence', 'Kevin Bacon']"
781,The Hangover,(2009),100 min,7.7,73        ,UA,"749,092",$277.32M,"Three buddies wake up from a bachelor party in Las Vegas, with no memory of the previous night and the bachelor missing. They make their way around the city in order to find their friend before his wedding.",Todd Phillips,"['Zach Galifianakis', 'Bradley Cooper', 'Justin Bartha', 'Ed Helms']"
782,Silver Linings Playbook,(2012),122 min,7.7,81        ,A,"685,025",$132.09M,"After a stint in a mental institution, former teacher Pat Solitano moves back in with his parents and tries to reconcile with his ex-wife. Things get more challenging when Pat meets Tiffany, a mysterious girl with problems of her own.",David O. Russell,"['Bradley Cooper', 'Jennifer Lawrence', 'Robert De Niro', 'Jacki Weaver']"
783,Argo,(2012),120 min,7.7,86        ,A,"594,442",$136.03M,"Acting under the cover of a Hollywood producer scouting a location for a science fiction film, a CIA agent launches a dangerous operation to rescue six Americans in Tehran during the U.S. hostage crisis in Iran in 1979.",Ben Affleck,"['Ben Affleck', 'Bryan Cranston', 'John Goodman', 'Alan Arkin']"
784,(500) Days of Summer,(2009),95 min,7.7,76        ,UA,"491,965",$32.39M,"An offbeat romantic comedy about a woman who doesn't believe true love exists, and the young man who falls for her.",Marc Webb,"['Zooey Deschanel', 'Joseph Gordon-Levitt', 'Geoffrey Arend', 'Chloë Grace Moretz']"
785,Harry Potter and the Deathly Hallows: Part 1,(2010),146 min,7.7,65        ,UA,"509,216",$295.98M,"As Harry, Ron, and Hermione race against time and evil to destroy the Horcruxes, they uncover the existence of the three most powerful objects in the wizarding world: the Deathly Hallows.",David Yates,"['Daniel Radcliffe', 'Emma Watson', 'Rupert Grint', 'Bill Nighy']"
786,Gake no ue no Ponyo,(2008),101 min,7.7,86        ,U,"134,829",$15.09M,"A five-year-old boy develops a relationship with Ponyo, a young goldfish princess who longs to become a human after falling in love with him.",Hayao Miyazaki,"['Cate Blanchett', 'Matt Damon', 'Liam Neeson', 'Tomoko Yamaguchi']"
787,Frost/Nixon,(2008),122 min,7.7,80        ,U,"106,246",$18.59M,A dramatic retelling of the post-Watergate television interviews between British talk-show host David Frost and former president Richard Nixon.,Ron Howard,"['Frank Langella', 'Michael Sheen', 'Kevin Bacon', 'Sam Rockwell']"
788,Papurika,(2006),90 min,7.7,81        ,U,"77,855",$0.88M,"When a machine that allows therapists to enter their patients' dreams is stolen, all hell breaks loose. Only a young female therapist, Paprika, can stop it.",Satoshi Kon,"['Megumi Hayashibara', 'Tôru Emori', 'Katsunosuke Hori', 'Tôru Furuya']"
789,Changeling,(2008),141 min,7.7,63        ,A,"248,112",$35.74M,Grief-stricken mother Christine Collins (Angelina Jolie) takes on the L.A.P.D. to her own detriment when it tries to pass off an obvious impostor as her missing child.,Clint Eastwood,"['Angelina Jolie', 'Colm Feore', 'Amy Ryan', 'Gattlin Griffith']"
790,Flipped,(I) (2010),90 min,7.7,45        ,PG,"87,146",$1.75M,Two eighth-graders start to have feelings for each other despite being total opposites.,Rob Reiner,"['Madeline Carroll', 'Callan McAuliffe', 'Rebecca De Mornay', 'Anthony Edwards']"
791,Toki o kakeru shôjo,(2006),98 min,7.7,****,U,"63,711",%^%^%^,"A high-school girl named Makoto acquires the power to travel back in time, and decides to use it for her own personal benefits. Little does she know that she is affecting the lives of others just as much as she is her own.",Mamoru Hosoda,"['Riisa Naka', 'Takuya Ishida', 'Mitsutaka Itakura', 'Ayami Kakiuchi']"
792,This Is England,(2006),101 min,7.7,86        ,A,"119,458",$0.33M,"A young boy becomes friends with a gang of skinheads. Friends soon become like family, and relationships will be pushed to the very limit.",Shane Meadows,"['Thomas Turgoose', 'Stephen Graham', 'Jo Hartley', 'Andrew Shim']"
793,Ex Machina,(2014),108 min,7.7,78        ,UA,"508,556",$25.44M,A young programmer is selected to participate in a ground-breaking experiment in synthetic intelligence by evaluating the human qualities of a highly advanced humanoid A.I.,Alex Garland,"['Alicia Vikander', 'Domhnall Gleeson', 'Oscar Isaac', 'Sonoya Mizuno']"
794,Efter brylluppet,(2006),120 min,7.7,78        ,R,"33,776",$0.41M,"A manager of an orphanage in India is sent to Copenhagen, Denmark, where he discovers a life-altering family secret.",Susanne Bier,"['Mads Mikkelsen', 'Sidse Babett Knudsen', 'Rolf Lassgård', 'Neeral Mulchandani']"
795,The Last King of Scotland,(2006),123 min,7.7,74        ,A,"181,937",$17.61M,Based on the events of the brutal Ugandan dictator Idi Amin's regime as seen by his personal physician during the 1970s.,Kevin Macdonald,"['James McAvoy', 'Forest Whitaker', 'Gillian Anderson', 'Kerry Washington']"
796,Zodiac,(2007),157 min,7.7,78        ,UA,"504,580",$33.08M,"Between 1968 and 1983, a San Francisco cartoonist becomes an amateur detective obsessed with tracking down the Zodiac Killer, an unidentified individual who terrorizes Northern California with a killing spree.",David Fincher,"['Jake Gyllenhaal', 'Robert Downey Jr.', 'Mark Ruffalo', 'Anthony Edwards']"
797,Lucky Number Slevin,(2006),110 min,7.7,53        ,R,"307,101",$22.49M,"A case of mistaken identity lands Slevin into the middle of a war being plotted by two of the city's most rival crime bosses. Under constant surveillance by Detective Brikowski and assassin Goodkat, he must get them before they get him.",Paul McGuigan,"['Josh Hartnett', 'Ben Kingsley', 'Morgan Freeman', 'Lucy Liu']"
798,Joyeux Noël,(2005),116 min,7.7,70        ,PG-13,"28,863",$1.05M,"In December 1914, an unofficial Christmas truce on the Western Front allows soldiers from opposing sides of the First World War to gain insight into each other's way of life.",Christian Carion,"['Diane Kruger', 'Benno Fürmann', 'Guillaume Canet', 'Natalie Dessay']"
799,Control,(2007),122 min,7.7,78        ,R,"63,813",$0.87M,"A profile of Ian Curtis, the enigmatic singer of Joy Division whose personal, professional, and romantic troubles led him to commit suicide at the age of 23.",Anton Corbijn,"['Sam Riley', 'Samantha Morton', 'Craig Parkinson', 'Alexandra Maria Lara']"
800,Tangled,(2010),100 min,7.7,71        ,U,"427,178",$200.82M,"The magically long-haired Rapunzel has spent her entire life in a tower, but now that a runaway thief has stumbled upon her, she is about to discover the world for the first time, and who she really is.","Directors:Nathan Greno, Byron Howard","['Mandy Moore', 'Zachary Levi', 'Donna Murphy', 'Ron Perlman']"
801,Zwartboek,(2006),145 min,7.7,71        ,A,"75,103",$4.40M,"In the Nazi-occupied Netherlands during World War II, a Jewish singer infiltrates the regional Gestapo headquarters for the Dutch resistance.",Paul Verhoeven,"['Carice van Houten', 'Sebastian Koch', 'Thom Hoffman', 'Halina Reijn']"
802,Brokeback Mountain,(2005),134 min,7.7,87        ,A,"341,559",$83.04M,Ennis and Jack are two shepherds who develop a sexual and emotional relationship. Their relationship becomes complicated when both of them get married to their respective girlfriends.,Ang Lee,"['Jake Gyllenhaal', 'Heath Ledger', 'Michelle Williams', 'Randy Quaid']"
803,3:10 to Yuma,(2007),122 min,7.7,76        ,A,"300,040",$53.61M,A small-time rancher agrees to hold a captured outlaw who's awaiting a train to go to court in Yuma. A battle of wills ensues as the outlaw tries to psych out the rancher.,James Mangold,"['Russell Crowe', 'Christian Bale', 'Ben Foster', 'Logan Lerman']"
804,Crash,(I) (2004),112 min,7.7,66        ,UA,"428,739",$54.58M,"Los Angeles citizens with vastly separate lives collide in interweaving stories of race, loss and redemption.",Paul Haggis,"['Don Cheadle', 'Sandra Bullock', 'Thandiwe Newton', 'Karina Arroyave']"
805,Kung fu,(2004),99 min,7.7,78        ,UA,"134,045",$17.11M,"In Shanghai, China in the 1940s, a wannabe gangster aspires to join the notorious ""Axe Gang"" while residents of a housing complex exhibit extraordinary powers in defending their turf.",Stephen Chow,"['Stephen Chow', 'Wah Yuen', 'Qiu Yuen', 'Siu-Lung Leung']"
806,The Bourne Supremacy,(2004),108 min,7.7,73        ,A,"449,338",$176.24M,"When Jason Bourne is framed for a CIA operation gone awry, he is forced to resume his former life as a trained assassin to survive.",Paul Greengrass,"['Matt Damon', 'Franka Potente', 'Joan Allen', 'Brian Cox']"
807,The Machinist,(2004),101 min,7.7,61        ,R,"373,817",$1.08M,An industrial worker who hasn't slept in a year begins to doubt his own sanity.,Brad Anderson,"['Christian Bale', 'Jennifer Jason Leigh', 'Aitana Sánchez-Gijón', 'John Sharian']"
808,Ray,(I) (2004),152 min,7.7,73        ,A,"143,758",$75.33M,"The story of the life and career of the legendary rhythm and blues musician Ray Charles, from his humble beginnings in the South, where he went blind at age seven, to his meteoric rise to stardom during the 1950s and 1960s.",Taylor Hackford,"['Jamie Foxx', 'Regina King', 'Kerry Washington', 'Clifton Powell']"
809,Lost in Translation,(2003),102 min,7.7,89        ,UA,"436,212",$44.59M,A faded movie star and a neglected young woman form an unlikely bond after crossing paths in Tokyo.,Sofia Coppola,"['Bill Murray', 'Scarlett Johansson', 'Giovanni Ribisi', 'Anna Faris']"
810,Harry Potter and the Goblet of Fire,(2005),157 min,7.7,81        ,UA,"581,032",$290.01M,"Harry Potter finds himself competing in a hazardous tournament between rival schools of magic, but he is distracted by recurring nightmares.",Mike Newell,"['Daniel Radcliffe', 'Emma Watson', 'Rupert Grint', 'Eric Sykes']"
811,Man on Fire,(2004),146 min,7.7,47        ,UA,"348,241",$77.91M,"In Mexico City, a former CIA operative swears vengeance on those who committed an unspeakable act against the family he was hired to protect.",Tony Scott,"['Denzel Washington', 'Christopher Walken', 'Dakota Fanning', 'Radha Mitchell']"
812,Coraline,(2009),100 min,7.7,80        ,U,"212,391",$75.29M,"An adventurous 11-year-old girl finds another world that is a strangely idealized version of her frustrating home, but it has sinister secrets.",Henry Selick,"['Dakota Fanning', 'Teri Hatcher', 'John Hodgman', 'Jennifer Saunders']"
813,The Last Samurai,(2003),154 min,7.7,55        ,UA,"418,867",$111.11M,An American military advisor embraces the Samurai culture he was hired to destroy after he is captured in battle.,Edward Zwick,"['Tom Cruise', 'Ken Watanabe', 'Billy Connolly', 'William Atherton']"
814,The Magdalene Sisters,(2002),114 min,7.7,83        ,R,"26,803",$4.89M,Three young Irish women struggle to maintain their spirits while they endure dehumanizing abuse as inmates of a Magdalene Sisters Asylum.,Peter Mullan,"['Eileen Walsh', 'Dorothy Duffy', 'Nora-Jane Noone', 'Anne-Marie Duff']"
815,Good Bye Lenin!,(2003),121 min,7.7,68        ,R,"142,629",$4.06M,"In 1990, to protect his fragile mother from a fatal shock after a long coma, a young man must keep her from learning that her beloved nation of East Germany as she knew it has disappeared.",Wolfgang Becker,"['Daniel Brühl', 'Katrin Saß', 'Chulpan Khamatova', 'Florian Lukas']"
816,In America,(2002),105 min,7.7,76        ,PG-13,"42,581",$15.54M,A family of Irish immigrants adjust to life on the mean streets of Hell's Kitchen while also grieving the death of a child.,Jim Sheridan,"['Paddy Considine', 'Samantha Morton', 'Djimon Hounsou', 'Sarah Bolger']"
817,Adaptation.,(2002),115 min,7.7,83        ,R,"187,114",$22.25M,A lovelorn screenwriter becomes desperate as he tries and fails to adapt 'The Orchid Thief' by Susan Orlean for the screen.,Spike Jonze,"['Nicolas Cage', 'Meryl Streep', 'Chris Cooper', 'Tilda Swinton']"
818,Black Hawk Down,(2001),144 min,7.7,74        ,A,"380,260",$108.64M,"The story of 160 elite U.S. soldiers who dropped into Mogadishu in October 1993 to capture two top lieutenants of a renegade warlord, but found themselves in a desperate battle with a large force of heavily-armed Somalis.",Ridley Scott,"['Josh Hartnett', 'Ewan McGregor', 'Tom Sizemore', 'Eric Bana']"
819,Road to Perdition,(2002),117 min,7.7,72        ,A,"258,893",$104.45M,"A mob enforcer's son in 1930s Illinois witnesses a murder, forcing him and his father to take to the road, and his father down a path of redemption and revenge.",Sam Mendes,"['Tom Hanks', 'Tyler Hoechlin', 'Rob Maxey', 'Liam Aiken']"
820,Das Experiment,(2001),120 min,7.7,60        ,R,"92,677",$0.14M,"For two weeks, 20 male participants are hired to play prisoners and guards in a prison. The ""prisoners"" have to follow seemingly mild rules, and the ""guards"" are told to retain order without using physical violence.",Oliver Hirschbiegel,"['Moritz Bleibtreu', 'Christian Berkel', 'Oliver Stokowski', 'Wotan Wilke Möhring']"
