,Movie Name,Year of Release,Watch Time,Movie Rating,Metascore of movie,Certificate,Votes,Gross,Description,Director,Stars
0,Jai Bhim,(2021),164 min,9.5,****,A,"146,787",%^%^%^,"When a tribal man is arrested for a case of alleged theft, his wife turns to a human-rights lawyer to help bring justice.",T.J. Gnanavel,"['Suriya', 'Lijo Mol Jose', 'Manikandan', 'Rajisha Vijayan']"
1,The Shawshank Redemption,(1994),142 min,9.3,80        ,A,"2,497,779",$28.34M,"Two imprisoned men bond over a number of years, finding solace and eventual redemption through acts of common decency.",Frank Darabont,"['Tim Robbins', 'Morgan Freeman', 'Bob Gunton', 'William Sadler']"
2,The Godfather,(1972),175 min,9.2,100        ,A,"1,722,316",$134.97M,The Godfather follows Vito Corleone Don of the Corleone family as he passes the mantel to his son Michael,Francis Ford Coppola,"['Marlon Brando', 'Al Pacino', 'James Caan', 'Diane Keaton']"
3,Soorarai Pottru,(2020),153 min,9.1,****,U,"103,122",%^%^%^,"Nedumaaran Rajangam ""Maara"" sets out to make the common man fly and in the process takes on the world's most capital intensive industry and several enemies who stand in his way.",Sudha Kongara,"['Suriya', 'Paresh Rawal', 'Aparna Balamurali', 'Gaurav Pareek']"
4,The Dark Knight,(2008),152 min,9.0,84        ,UA,"2,448,289",$534.86M,"When the menace known as the Joker wreaks havoc and chaos on the people of Gotham, Batman must accept one of the greatest psychological and physical tests of his ability to fight injustice.",Christopher Nolan,"['Christian Bale', 'Heath Ledger', 'Aaron Eckhart', 'Michael Caine']"
5,The Godfather: Part II,(1974),202 min,9.0,90        ,A,"1,195,457",$57.30M,"The early life and career of Vito Corleone in 1920s New York City is portrayed, while his son, Michael, expands and tightens his grip on the family crime syndicate.",Francis Ford Coppola,"['Al Pacino', 'Robert De Niro', 'Robert Duvall', 'Diane Keaton']"
6,12 Angry Men,(1957),96 min,9.0,96        ,U,"737,868",$4.36M,The jury in a New York City murder trial is frustrated by a single member whose skeptical caution forces them to more carefully consider the evidence before jumping to a hasty verdict.,Sidney Lumet,"['Henry Fonda', 'Lee J. Cobb', 'Martin Balsam', 'John Fiedler']"
7,Sardar Udham,(2021),164 min,8.9,****,UA 13+,"30,400",%^%^%^,A biopic detailing the 2 decades that Punjabi Sikh revolutionary Udham Singh spent planning the assassination of the man responsible for the Jallianwala Bagh massacre.,Shoojit Sircar,"['Vicky Kaushal', 'Banita Sandhu', 'Shaun Scott', 'Stephen Hogan']"
8,The Lord of the Rings: The Return of the King,(2003),201 min,8.9,94        ,U,"1,726,427",$377.85M,Gandalf and Aragorn lead the World of Men against Sauron's army to draw his gaze from Frodo and Sam as they approach Mount Doom with the One Ring.,Peter Jackson,"['Elijah Wood', 'Viggo Mortensen', 'Ian McKellen', 'Orlando Bloom']"
9,Pulp Fiction,(1994),154 min,8.9,94        ,A,"1,928,388",$107.93M,"The lives of two mob hitmen, a boxer, a gangster and his wife, and a pair of diner bandits intertwine in four tales of violence and redemption.",Quentin Tarantino,"['John Travolta', 'Uma Thurman', 'Samuel L. Jackson', 'Bruce Willis']"
10,Schindler's List,(1993),195 min,8.9,94        ,A,"1,278,733",$96.90M,"In German-occupied Poland during World War II, industrialist Oskar Schindler gradually becomes concerned for his Jewish workforce after witnessing their persecution by the Nazis.",Steven Spielberg,"['Liam Neeson', 'Ralph Fiennes', 'Ben Kingsley', 'Caroline Goodall']"
11,Inception,(2010),148 min,8.8,74        ,UA,"2,196,876",$292.58M,"A thief who steals corporate secrets through the use of dream-sharing technology is given the inverse task of planting an idea into the mind of a C.E.O., but his tragic past may doom the project and his team to disaster.",Christopher Nolan,"['Leonardo DiCaprio', 'Joseph Gordon-Levitt', 'Elliot Page', 'Ken Watanabe']"
12,Dara iz Jasenovca,(2020),130 min,8.8,****,R,"79,879",%^%^%^,Follows the story of a young girl named Dara who is sent to a concentration camp in Croatia during World War 2.,Predrag Antonijevic,"['Biljana Cekic', 'Zlatan Vidovic', 'Anja Stanic', 'Luka Saranovic']"
13,Fight Club,(1999),139 min,8.8,66        ,A,"1,965,351",$37.03M,An insomniac office worker and a devil-may-care soap maker form an underground fight club that evolves into much more.,David Fincher,"['Brad Pitt', 'Edward Norton', 'Meat Loaf', 'Zach Grenier']"
14,The Lord of the Rings: The Fellowship of the Ring,(2001),178 min,8.8,92        ,U,"1,747,731",$315.54M,A meek Hobbit from the Shire and eight companions set out on a journey to destroy the powerful One Ring and save Middle-earth from the Dark Lord Sauron.,Peter Jackson,"['Elijah Wood', 'Ian McKellen', 'Orlando Bloom', 'Sean Bean']"
15,Forrest Gump,(1994),142 min,8.8,82        ,UA,"1,928,296",$330.25M,"The presidencies of Kennedy and Johnson, the Vietnam War, the Watergate scandal and other historical events unfold from the perspective of an Alabama man with an IQ of 75, whose only desire is to be reunited with his childhood sweetheart.",Robert Zemeckis,"['Tom Hanks', 'Robin Wright', 'Gary Sinise', 'Sally Field']"
16,"Il buono, il brutto, il cattivo",(1966),161 min,8.8,90        ,A,"724,183",$6.10M,A bounty hunting scam joins two men in an uneasy alliance against a third in a race to find a fortune in gold buried in a remote cemetery.,Sergio Leone,"['Clint Eastwood', 'Eli Wallach', 'Lee Van Cleef', 'Aldo Giuffrè']"
17,Shershaah,(2021),135 min,8.7,****,UA,"108,570",%^%^%^,"The story of PVC awardee Indian soldier Capt. Vikram Batra, who shot to fame and became a household name during the Kargil War in 1999.",Vishnuvardhan,"['Sidharth Malhotra', 'Kiara Advani', 'Shiv Panditt', 'Pranay Pachauri']"
18,The Lord of the Rings: The Two Towers,(2002),179 min,8.7,87        ,UA,"1,560,645",$342.55M,"While Frodo and Sam edge closer to Mordor with the help of the shifty Gollum, the divided fellowship makes a stand against Sauron's new ally, Saruman, and his hordes of Isengard.",Peter Jackson,"['Elijah Wood', 'Ian McKellen', 'Viggo Mortensen', 'Orlando Bloom']"
19,The Matrix,(1999),136 min,8.7,73        ,A,"1,781,559",$171.48M,"When a beautiful stranger leads computer hacker Neo to a forbidding underworld, he discovers the shocking truth--the life he knows is the elaborate deception of an evil cyber-intelligence.","Directors:Lana Wachowski, Lilly Wachowski","['Keanu Reeves', 'Laurence Fishburne', 'Carrie-Anne Moss', 'Hugo Weaving']"
20,Goodfellas,(1990),146 min,8.7,90        ,A,"1,081,811",$46.84M,"The story of Henry Hill and his life in the mob, covering his relationship with his wife Karen Hill and his mob partners Jimmy Conway and Tommy DeVito in the Italian-American crime syndicate.",Martin Scorsese,"['Robert De Niro', 'Ray Liotta', 'Joe Pesci', 'Lorraine Bracco']"
21,Star Wars: Episode V - The Empire Strikes Back,(1980),124 min,8.7,82        ,UA,"1,216,123",$290.48M,"After the Rebels are brutally overpowered by the Empire on the ice planet Hoth, Luke Skywalker begins Jedi training with Yoda, while his friends are pursued across the galaxy by Darth Vader and bounty hunter Boba Fett.",Irvin Kershner,"['Mark Hamill', 'Harrison Ford', 'Carrie Fisher', 'Billy Dee Williams']"
22,One Flew Over the Cuckoo's Nest,(1975),133 min,8.7,84        ,A,"961,627",$112.00M,"A criminal pleads insanity and is admitted to a mental institution, where he rebels against the oppressive nurse and rallies up the scared patients.",Milos Forman,"['Jack Nicholson', 'Louise Fletcher', 'Michael Berryman', 'Peter Brocco']"
23,96,(II) (2018),158 min,8.6,****,U,"25,991",%^%^%^,Two high school sweethearts meet at a reunion after 22 years and reminisce about their past.,C. Prem Kumar,"['Vijay Sethupathi', 'Adithya Bhaskar', 'Trisha Krishnan', 'Gouri Kishan']"
24,Gisaengchung,(2019),132 min,8.6,96        ,A,"686,287",$53.37M,Greed and class discrimination threaten the newly formed symbiotic relationship between the wealthy Park family and the destitute Kim clan.,Bong Joon Ho,"['Kang-ho Song', 'Sun-kyun Lee', 'Yeo-jeong Cho', 'Woo-sik Choi']"
25,Drishyam 2,(2021),152 min,8.6,****,13,"32,115",%^%^%^,A gripping tale of an investigation and a family which is threatened by it. Will Georgekutty be able to protect his family this time?,Jeethu Joseph,"['Mohanlal', 'Meena', 'Ansiba', 'Esther Anil']"
26,Interstellar,(2014),169 min,8.6,74        ,UA,"1,646,350",$188.02M,A team of explorers travel through a wormhole in space in an attempt to ensure humanity's survival.,Christopher Nolan,"['Matthew McConaughey', 'Anne Hathaway', 'Jessica Chastain', 'Mackenzie Foy']"
27,Cidade de Deus,(2002),130 min,8.6,79        ,A,"726,960",$7.56M,"In the slums of Rio, two kids' paths diverge as one struggles to become a photographer and the other a kingpin.","Directors:Fernando Meirelles, Kátia Lund","['Alexandre Rodrigues', 'Leandro Firmino', 'Matheus Nachtergaele', 'Phellipe Haagensen']"
28,Sen to Chihiro no kamikakushi,(2001),125 min,8.6,96        ,U,"703,383",$10.06M,"During her family's move to the suburbs, a sullen 10-year-old girl wanders into a world ruled by gods, witches, and spirits, and where humans are changed into beasts.",Hayao Miyazaki,"['Daveigh Chase', 'Suzanne Pleshette', 'Miyu Irino', 'Rumi Hiiragi']"
29,Saving Private Ryan,(1998),169 min,8.6,91        ,A,"1,305,837",$216.54M,"Following the Normandy Landings, a group of U.S. soldiers go behind enemy lines to retrieve a paratrooper whose brothers have been killed in action.",Steven Spielberg,"['Tom Hanks', 'Matt Damon', 'Tom Sizemore', 'Edward Burns']"
30,The Green Mile,(1999),189 min,8.6,61        ,UA,"1,216,221",$136.80M,"The lives of guards on Death Row are affected by one of their charges: a black man accused of child murder and rape, yet who has a mysterious gift.",Frank Darabont,"['Tom Hanks', 'Michael Clarke Duncan', 'David Morse', 'Bonnie Hunt']"
31,La vita è bella,(1997),116 min,8.6,59        ,U,"658,509",$57.60M,"When an open-minded Jewish waiter and his son become victims of the Holocaust, he uses a perfect mixture of will, humor, and imagination to protect his son from the dangers around their camp.",Roberto Benigni,"['Roberto Benigni', 'Nicoletta Braschi', 'Giorgio Cantarini', 'Giustino Durano']"
32,Se7en,(1995),127 min,8.6,65        ,A,"1,534,659",$100.13M,"Two detectives, a rookie and a veteran, hunt a serial killer who uses the seven deadly sins as his motives.",David Fincher,"['Morgan Freeman', 'Brad Pitt', 'Kevin Spacey', 'Andrew Kevin Walker']"
33,The Silence of the Lambs,(1991),118 min,8.6,85        ,A,"1,346,063",$130.74M,"A young F.B.I. cadet must receive the help of an incarcerated and manipulative cannibal killer to help catch another serial killer, a madman who skins his victims.",Jonathan Demme,"['Jodie Foster', 'Anthony Hopkins', 'Lawrence A. Bonney', 'Kasi Lemmons']"
34,Star Wars,(1977),121 min,8.6,90        ,UA,"1,287,802",$322.74M,"Luke Skywalker joins forces with a Jedi Knight, a cocky pilot, a Wookiee and two droids to save the galaxy from the Empire's world-destroying battle station, while also attempting to rescue Princess Leia from the mysterious Darth Vader.",George Lucas,"['Mark Hamill', 'Harrison Ford', 'Carrie Fisher', 'Alec Guinness']"
35,Seppuku,(1962),133 min,8.6,85        ,****,"50,410",%^%^%^,"When a ronin requesting seppuku at a feudal lord's palace is told of the brutal suicide of another ronin who previously visited, he reveals how their pasts are intertwined - and in doing so challenges the clan's integrity.",Masaki Kobayashi,"['Tatsuya Nakadai', 'Akira Ishihama', 'Shima Iwashita', 'Tetsurô Tanba']"
36,Shichinin no samurai,(1954),207 min,8.6,98        ,U,"331,686",$0.27M,A poor village under attack by bandits recruits seven unemployed samurai to help them defend themselves.,Akira Kurosawa,"['Toshirô Mifune', 'Takashi Shimura', 'Keiko Tsushima', 'Yukiko Shimazaki']"
37,It's a Wonderful Life,(1946),130 min,8.6,89        ,PG,"425,922",%^%^%^,An angel is sent from Heaven to help a desperately frustrated businessman by showing him what life would have been like if he had never existed.,Frank Capra,"['James Stewart', 'Donna Reed', 'Lionel Barrymore', 'Thomas Mitchell']"
38,Whiplash,(2014),106 min,8.5,88        ,A,"774,580",$13.09M,A promising young drummer enrolls at a cut-throat music conservatory where his dreams of greatness are mentored by an instructor who will stop at nothing to realize a student's potential.,Damien Chazelle,"['Miles Teller', 'J.K. Simmons', 'Melissa Benoist', 'Paul Reiser']"
39,The Intouchables,(2011),112 min,8.5,57        ,UA,"805,566",$13.18M,"After he becomes a quadriplegic from a paragliding accident, an aristocrat hires a young man from the projects to be his caregiver.","Directors:Olivier Nakache, Éric Toledano","['François Cluzet', 'Omar Sy', 'Anne Le Ny', 'Audrey Fleurot']"
40,The Prestige,(2006),130 min,8.5,66        ,U,"1,257,933",$53.09M,"After a tragic accident, two stage magicians in 1890s London engage in a battle to create the ultimate illusion while sacrificing everything they have to outwit each other.",Christopher Nolan,"['Christian Bale', 'Hugh Jackman', 'Scarlett Johansson', 'Michael Caine']"
41,The Departed,(2006),151 min,8.5,85        ,A,"1,252,429",$132.38M,An undercover cop and a mole in the police attempt to identify each other while infiltrating an Irish gang in South Boston.,Martin Scorsese,"['Leonardo DiCaprio', 'Matt Damon', 'Jack Nicholson', 'Mark Wahlberg']"
42,The Pianist,(2002),150 min,8.5,85        ,13,"779,402",$32.57M,A Polish Jewish musician struggles to survive the destruction of the Warsaw ghetto of World War II.,Roman Polanski,"['Adrien Brody', 'Thomas Kretschmann', 'Frank Finlay', 'Emilia Fox']"
43,Gladiator,(2000),155 min,8.5,67        ,UA,"1,413,794",$187.71M,A former Roman General sets out to exact vengeance against the corrupt emperor who murdered his family and sent him into slavery.,Ridley Scott,"['Russell Crowe', 'Joaquin Phoenix', 'Connie Nielsen', 'Oliver Reed']"
44,American History X,(1998),119 min,8.5,62        ,R,"1,074,755",$6.72M,A former neo-nazi skinhead tries to prevent his younger brother from going down the same wrong path that he did.,Tony Kaye,"['Edward Norton', 'Edward Furlong', ""Beverly D'Angelo"", 'Jennifer Lien']"
45,The Usual Suspects,(1995),106 min,8.5,77        ,A,"1,036,931",$23.34M,"A sole survivor tells of the twisty events leading up to a horrific gun battle on a boat, which began when five criminals met at a seemingly random police lineup.",Bryan Singer,"['Kevin Spacey', 'Gabriel Byrne', 'Chazz Palminteri', 'Stephen Baldwin']"
46,Léon,(1994),110 min,8.5,64        ,A,"1,093,525",$19.50M,"Mathilda, a 12-year-old girl, is reluctantly taken in by Léon, a professional assassin, after her family is murdered. An unusual relationship forms as she becomes his protégée and learns the assassin's trade.",Luc Besson,"['Jean Reno', 'Gary Oldman', 'Natalie Portman', 'Danny Aiello']"
47,The Lion King,(1994),88 min,8.5,88        ,U,"993,283",$422.78M,"Lion prince Simba and his father are targeted by his bitter uncle, who wants to ascend the throne himself.","Directors:Roger Allers, Rob Minkoff","['Matthew Broderick', 'Jeremy Irons', 'James Earl Jones', 'Whoopi Goldberg']"
48,Terminator 2: Judgment Day,(1991),137 min,8.5,75        ,A,"1,042,332",$204.84M,"A cyborg, identical to the one who failed to kill Sarah Connor, must now protect her ten-year-old son John from a more advanced and powerful cyborg.",James Cameron,"['Arnold Schwarzenegger', 'Linda Hamilton', 'Edward Furlong', 'Robert Patrick']"
49,Nuovo Cinema Paradiso,(1988),155 min,8.5,80        ,U,"247,868",$11.99M,A filmmaker recalls his childhood when falling in love with the pictures at the cinema of his home village and forms a deep friendship with the cinema's projectionist.,Giuseppe Tornatore,"['Philippe Noiret', 'Enzo Cannavale', 'Antonella Attili', 'Isa Danieli']"
50,Hotaru no haka,(1988),89 min,8.5,94        ,U,"256,285",%^%^%^,A young boy and his little sister struggle to survive in Japan during World War II.,Isao Takahata,"['Tsutomu Tatsumi', 'Ayano Shiraishi', 'Akemi Yamaguchi', 'Yoshiko Shinohara']"
51,Back to the Future,(1985),116 min,8.5,87        ,U,"1,124,986",$210.61M,"Marty McFly, a 17-year-old high school student, is accidentally sent thirty years into the past in a time-traveling DeLorean invented by his close friend, the eccentric scientist Doc Brown.",Robert Zemeckis,"['Michael J. Fox', 'Christopher Lloyd', 'Lea Thompson', 'Crispin Glover']"
52,Once Upon a Time in the West,(1968),165 min,8.5,80        ,U,"316,793",$5.32M,A mysterious stranger with a harmonica joins forces with a notorious desperado to protect a beautiful widow from a ruthless assassin working for the railroad.,Sergio Leone,"['Henry Fonda', 'Charles Bronson', 'Claudia Cardinale', 'Jason Robards']"
53,Psycho,(1960),109 min,8.5,97        ,A,"637,457",$32.00M,"A Phoenix secretary embezzles $40,000 from her employer's client, goes on the run, and checks into a remote motel run by a young man under the domination of his mother.",Alfred Hitchcock,"['Anthony Perkins', 'Janet Leigh', 'Vera Miles', 'John Gavin']"
54,Rear Window,(1954),112 min,8.5,100        ,U,"469,696",$36.76M,"A wheelchair-bound photographer spies on his neighbors from his Greenwich Village courtyard apartment window, and becomes convinced one of them has committed murder, despite the skepticism of his fashion-model girlfriend.",Alfred Hitchcock,"['James Stewart', 'Grace Kelly', 'Wendell Corey', 'Thelma Ritter']"
55,Casablanca,(1942),102 min,8.5,100        ,U,"547,108",$1.02M,A cynical expatriate American cafe owner struggles to decide whether or not to help his former lover and her fugitive husband escape the Nazis in French Morocco.,Michael Curtiz,"['Humphrey Bogart', 'Ingrid Bergman', 'Paul Henreid', 'Claude Rains']"
56,Modern Times,(1936),87 min,8.5,96        ,****,"230,827",$0.16M,The Tramp struggles to live in modern industrial society with the help of a young homeless woman.,Charles Chaplin,"['Charles Chaplin', 'Paulette Goddard', 'Henry Bergman', 'Tiny Sandford']"
57,City Lights,(1931),87 min,8.5,99        ,G,"177,524",$0.02M,"With the aid of a wealthy erratic tippler, a dewy-eyed tramp who has fallen in love with a sightless flower girl accumulates money to be able to help her medically.",Charles Chaplin,"['Charles Chaplin', 'Virginia Cherrill', 'Florence Lee', 'Harry Myers']"
58,Hamilton,(2020),160 min,8.4,90        ,12+,"77,148",%^%^%^,"The real life of one of America's foremost founding fathers and first Secretary of the Treasury, Alexander Hamilton. Captured live on Broadway from the Richard Rodgers Theater with the original Broadway cast.",Thomas Kail,"['Lin-Manuel Miranda', 'Phillipa Soo', 'Leslie Odom Jr.', 'Renée Elise Goldsberry']"
59,Capharnaüm,(2018),126 min,8.4,75        ,A,"78,173",$1.66M,"While serving a five-year sentence for a violent crime, a 12-year-old boy sues his parents for neglect.",Nadine Labaki,"['Zain Al Rafeea', 'Yordanos Shiferaw', 'Boluwatife Treasure Bankole', 'Kawsar Al Haddad']"
60,Joker,(2019),122 min,8.4,59        ,A,"1,100,661",$335.45M,"In Gotham City, mentally troubled comedian Arthur Fleck is disregarded and mistreated by society. He then embarks on a downward spiral of revolution and bloody crime. This path brings him face-to-face with his alter-ego: the Joker.",Todd Phillips,"['Joaquin Phoenix', 'Robert De Niro', 'Zazie Beetz', 'Frances Conroy']"
61,Ratsasan,(2018),170 min,8.4,****,UA,"36,445",%^%^%^,A sub-inspector sets out in pursuit of a mysterious serial killer who targets teen school girls and murders them brutally.,Ram Kumar,"['Vishnu Vishal', 'Amala Paul', 'Radha Ravi', 'Sangili Murugan']"
62,Ayla: The Daughter of War,(2017),125 min,8.4,****,****,"37,467",%^%^%^,"In 1950, amid-st the ravages of the Korean War, Sergeant Süleyman stumbles upon a half-frozen little girl, with no parents and no help in sight. Frantic, scared and on the verge of death, ...                See full summary »","Directors:Can Ulkay, Halenur Uzunoglu","['Çetin Tekindor', 'Ismail Hacioglu', 'Kyung-jin Lee', 'Kim Seol']"
63,Kimi no na wa.,(2016),106 min,8.4,79        ,U,"231,438",$5.02M,"Two strangers find themselves linked in a bizarre way. When a connection forms, will distance be the only thing to keep them apart?",Makoto Shinkai,"['Ryûnosuke Kamiki', 'Mone Kamishiraishi', 'Ryô Narita', 'Aoi Yûki']"
64,Dangal,(2016),161 min,8.4,****,U,"174,242",$12.39M,Former wrestler Mahavir Singh Phogat and his two wrestler daughters struggle towards glory at the Commonwealth Games in the face of societal oppression.,Nitesh Tiwari,"['Aamir Khan', 'Sakshi Tanwar', 'Fatima Sana Shaikh', 'Sanya Malhotra']"
65,Spider-Man: Into the Spider-Verse,(2018),117 min,8.4,87        ,U,"439,281",$190.24M,"Teen Miles Morales becomes the Spider-Man of his universe, and must join with five spider-powered individuals from other dimensions to stop a threat for all realities.","Directors:Bob Persichetti, Peter Ramsey, Rodney Rothman","['Shameik Moore', 'Jake Johnson', 'Hailee Steinfeld', 'Mahershala Ali']"
66,Avengers: Endgame,(2019),181 min,8.4,78        ,UA,"966,328",$858.37M,"After the devastating events of Avengers: Infinity War (2018), the universe is in ruins. With the help of remaining allies, the Avengers assemble once more in order to reverse Thanos' actions and restore balance to the universe.","Directors:Anthony Russo, Joe Russo","['Robert Downey Jr.', 'Chris Evans', 'Mark Ruffalo', 'Chris Hemsworth']"
67,Avengers: Infinity War,(2018),149 min,8.4,68        ,UA,"945,178",$678.82M,The Avengers and their allies must be willing to sacrifice all in an attempt to defeat the powerful Thanos before his blitz of devastation and ruin puts an end to the universe.,"Directors:Anthony Russo, Joe Russo","['Robert Downey Jr.', 'Chris Hemsworth', 'Mark Ruffalo', 'Chris Evans']"
68,Coco,(I) (2017),105 min,8.4,81        ,U,"442,942",$209.73M,"Aspiring musician Miguel, confronted with his family's ancestral ban on music, enters the Land of the Dead to find his great-great-grandfather, a legendary singer.","Directors:Lee Unkrich, Adrian Molina","['Anthony Gonzalez', 'Gael García Bernal', 'Benjamin Bratt', 'Alanna Ubach']"
69,Django Unchained,(2012),165 min,8.4,81        ,A,"1,445,084",$162.81M,"With the help of a German bounty-hunter, a freed slave sets out to rescue his wife from a brutal plantation-owner in Mississippi.",Quentin Tarantino,"['Jamie Foxx', 'Christoph Waltz', 'Leonardo DiCaprio', 'Kerry Washington']"
70,The Dark Knight Rises,(2012),164 min,8.4,78        ,UA,"1,593,921",$448.14M,"Eight years after the Joker's reign of anarchy, Batman, with the help of the enigmatic Catwoman, is forced from his exile to save Gotham City from the brutal guerrilla terrorist Bane.",Christopher Nolan,"['Christian Bale', 'Tom Hardy', 'Anne Hathaway', 'Gary Oldman']"
71,3 Idiots,(2009),170 min,8.4,67        ,UA,"372,137",$6.53M,"Two friends are searching for their long lost companion. They revisit their college days and recall the memories of their friend who inspired them to think differently, even as the rest of the world called them ""idiots"".",Rajkumar Hirani,"['Aamir Khan', 'Madhavan', 'Mona Singh', 'Sharman Joshi']"
72,Taare Zameen Par,(2007),165 min,8.4,****,U,"182,722",$1.22M,"An eight-year-old boy is thought to be a lazy trouble-maker, until the new art teacher has the patience and compassion to discover the real problem behind his struggles in school.","Directors:Aamir Khan, Amole Gupte","['Darsheel Safary', 'Aamir Khan', 'Tisca Chopra', 'Vipin Sharma']"
73,WALL·E,(2008),98 min,8.4,95        ,U,"1,052,305",$223.81M,"In the distant future, a small waste-collecting robot inadvertently embarks on a space journey that will ultimately decide the fate of mankind.",Andrew Stanton,"['Ben Burtt', 'Elissa Knight', 'Jeff Garlin', 'Fred Willard']"
74,The Lives of Others,(2006),137 min,8.4,89        ,A,"375,554",$11.29M,"In 1984 East Berlin, an agent of the secret police, conducting surveillance on a writer and his lover, finds himself becoming increasingly absorbed by their lives.",Florian Henckel von Donnersmarck,"['Ulrich Mühe', 'Martina Gedeck', 'Sebastian Koch', 'Ulrich Tukur']"
75,Oldeuboi,(2003),101 min,8.4,77        ,A,"547,005",$0.71M,"After being kidnapped and imprisoned for fifteen years, Oh Dae-Su is released, only to find that he must find his captor in five days.",Park Chan-Wook,"['Choi Min-sik', 'Yoo Ji-Tae', 'Kang Hye-jeong', 'Kim Byeong-Ok']"
76,Memento,(2000),113 min,8.4,80        ,UA,"1,178,812",$25.54M,A man with short-term memory loss attempts to track down his wife's murderer.,Christopher Nolan,"['Guy Pearce', 'Carrie-Anne Moss', 'Joe Pantoliano', 'Mark Boone Junior']"
77,Mononoke-hime,(1997),134 min,8.4,76        ,U,"369,230",$2.38M,"On a journey to find the cure for a Tatarigami's curse, Ashitaka finds himself in the middle of a war between the forest gods and Tatara, a mining colony. In this quest he also meets San, the Mononoke Hime.",Hayao Miyazaki,"['Yôji Matsuda', 'Yuriko Ishida', 'Yûko Tanaka', 'Billy Crudup']"
78,Raiders of the Lost Ark,(1981),115 min,8.4,85        ,A,"923,868",$248.16M,"In 1936, archaeologist and adventurer Indiana Jones is hired by the U.S. government to find the Ark of the Covenant before Adolf Hitler's Nazis can obtain its awesome powers.",Steven Spielberg,"['Harrison Ford', 'Karen Allen', 'Paul Freeman', 'John Rhys-Davies']"
79,The Shining,(1980),146 min,8.4,66        ,A,"956,066",$44.02M,"A family heads to an isolated hotel for the winter where a sinister presence influences the father into violence, while his psychic son sees horrific forebodings from both past and future.",Stanley Kubrick,"['Jack Nicholson', 'Shelley Duvall', 'Danny Lloyd', 'Scatman Crothers']"
