,Movie Name,Year of Release,Watch Time,Movie Rating,Metascore of movie,Certificate,Votes,Gross,Description,Director,Stars
494,Captain Fantastic,(2016),118 min,7.9,72        ,18,"207,655",$5.88M,"In the forests of the Pacific Northwest, a father devoted to raising his six kids with a rigorous physical and intellectual education is forced to leave his paradise and enter the world, challenging his idea of what it means to be a parent.",Matt Ross,"['Viggo Mortensen', 'George MacKay', 'Samantha Isler', 'Annalise Basso']"
495,Sing Street,(2016),106 min,7.9,79        ,PG-13,"90,117",$3.24M,A boy growing up in Dublin during the 1980s escapes his strained family life by starting a band to impress the mysterious girl he likes.,John Carney,"['Ferdia Walsh-Peelo', 'Aidan Gillen', 'Maria Doyle Kennedy', 'Jack Reynor']"
496,Thor: Ragnarok,(2017),130 min,7.9,74        ,UA,"659,516",$315.06M,"Imprisoned on the planet Sakaar, Thor must race against time to return to Asgard and stop Ragnarök, the destruction of his world, at the hands of the powerful and ruthless villain Hela.",Taika Waititi,"['Chris Hemsworth', 'Tom Hiddleston', 'Cate Blanchett', 'Mark Ruffalo']"
497,Jojo Rabbit,(2019),108 min,7.9,58        ,UA,"346,498",$0.35M,A young German boy in the Hitler Youth whose hero and imaginary friend is the country's dictator is shocked to discover that his mother is hiding a Jewish girl in their home.,Taika Waititi,"['Roman Griffin Davis', 'Thomasin McKenzie', 'Scarlett Johansson', 'Taika Waititi']"
498,Arrival,(II) (2016),116 min,7.9,81        ,UA,"648,707",$100.55M,A linguist works with the military to communicate with alien lifeforms after twelve mysterious spacecraft appear around the world.,Denis Villeneuve,"['Amy Adams', 'Jeremy Renner', 'Forest Whitaker', 'Michael Stuhlbarg']"
499,Gully Boy,(2019),154 min,7.9,65        ,UA,"36,315",$5.57M,A coming-of-age story based on the lives of street rappers in Mumbai.,Zoya Akhtar,"['Vijay Varma', 'Nakul Roshan Sahdev', 'Ranveer Singh', 'Vijay Raaz']"
500,Before Midnight,(2013),109 min,7.9,94        ,R,"150,118",$8.11M,We meet Jesse and Celine nine years on in Greece. Almost two decades have passed since their first meeting on that train bound for Vienna.,Richard Linklater,"['Ethan Hawke', 'Julie Delpy', 'Seamus Davey-Fitzpatrick', 'Ariane Labed']"
501,X-Men: Days of Future Past,(2014),132 min,7.9,75        ,UA,"684,087",$233.92M,The X-Men send Wolverine to the past in a desperate effort to change history and prevent an event that results in doom for both humans and mutants.,Bryan Singer,"['Patrick Stewart', 'Ian McKellen', 'Hugh Jackman', 'James McAvoy']"
502,Bir Zamanlar Anadolu'da,(2011),157 min,7.9,82        ,****,"44,879",$0.14M,A group of men set out in search of a dead body in the Anatolian steppes.,Nuri Bilge Ceylan,"['Muhammet Uzuner', 'Yilmaz Erdogan', 'Taner Birsel', 'Ahmet Mümtaz Taylan']"
503,Bohemian Rhapsody,(2018),134 min,7.9,49        ,UA,"495,679",$216.43M,"The story of the legendary British rock band Queen and lead singer Freddie Mercury, leading up to their famous performance at Live Aid (1985).",Bryan Singer,"['Rami Malek', 'Lucy Boynton', 'Gwilym Lee', 'Ben Hardy']"
504,The Perks of Being a Wallflower,(2012),103 min,7.9,67        ,UA,"485,897",$17.74M,An introvert freshman is taken under the wings of two seniors who welcome him to the real world.,Stephen Chbosky,"['Logan Lerman', 'Emma Watson', 'Ezra Miller', 'Paul Rudd']"
505,The Artist,(I) (2011),100 min,7.9,89        ,U,"236,914",$44.67M,An egomaniacal film star develops a relationship with a young dancer against the backdrop of Hollywood's silent era.,Michel Hazanavicius,"['Jean Dujardin', 'Bérénice Bejo', 'John Goodman', 'James Cromwell']"
506,Edge of Tomorrow,(2014),113 min,7.9,71        ,UA,"638,251",$100.21M,"A soldier fighting aliens gets to relive the same day over and over again, the day restarting every time he dies.",Doug Liman,"['Tom Cruise', 'Emily Blunt', 'Bill Paxton', 'Brendan Gleeson']"
507,Amour,(2012),127 min,7.9,94        ,UA,"97,238",$6.74M,"Georges and Anne are an octogenarian couple. They are cultivated, retired music teachers. Their daughter, also a musician, lives in Britain with her family. One day, Anne has a stroke, and the couple's bond of love is severely tested.",Michael Haneke,"['Jean-Louis Trintignant', 'Emmanuelle Riva', 'Isabelle Huppert', 'Alexandre Tharaud']"
508,Un prophète,(2009),155 min,7.9,90        ,A,"96,750",$2.08M,A young Algerian man is sent to a French prison.,Jacques Audiard,"['Tahar Rahim', 'Niels Arestrup', 'Adel Bencherif', 'Reda Kateb']"
509,Låt den rätte komma in,(2008),114 min,7.9,82        ,R,"211,653",$2.12M,"Oskar, an overlooked and bullied boy, finds love and revenge through Eli, a beautiful but peculiar girl.",Tomas Alfredson,"['Kåre Hedebrant', 'Lina Leandersson', 'Per Ragnar', 'Henrik Dahl']"
510,District 9,(2009),112 min,7.9,81        ,A,"659,207",$115.65M,Violence ensues after an extraterrestrial race forced to live in slum-like conditions on Earth finds a kindred spirit in a government agent exposed to their biotechnology.,Neill Blomkamp,"['Sharlto Copley', 'David James', 'Jason Cope', 'Nathalie Boltt']"
511,The Wrestler,(2008),109 min,7.9,80        ,UA,"298,325",$26.24M,"A faded professional wrestler must retire, but finds his quest for a new life outside the ring a dispiriting struggle.",Darren Aronofsky,"['Mickey Rourke', 'Marisa Tomei', 'Evan Rachel Wood', 'Mark Margolis']"
512,Jab We Met,(2007),138 min,7.9,****,U,"50,668",$0.41M,A depressed wealthy businessman finds his life changing after he meets a spunky and care-free young woman.,Imtiaz Ali,"['Shahid Kapoor', 'Kareena Kapoor', 'Tarun Arora', 'Dara Singh']"
513,Boyhood,(I) (2014),165 min,7.9,100        ,A,"346,121",$25.38M,"The life of Mason, from early childhood to his arrival at college.",Richard Linklater,"['Ellar Coltrane', 'Patricia Arquette', 'Ethan Hawke', 'Elijah Smith']"
514,"4 luni, 3 saptamâni si 2 zile",(2007),113 min,7.9,97        ,****,"58,811",$1.19M,A woman assists her friend in arranging an illegal abortion in 1980s Romania.,Cristian Mungiu,"['Anamaria Marinca', 'Laura Vasiliu', 'Vlad Ivanov', 'Alexandru Potocean']"
515,Star Trek,(2009),127 min,7.9,82        ,UA,"592,375",$257.73M,The brash James T. Kirk tries to live up to his father's legacy with Mr. Spock keeping him in check as a vengeful Romulan from the future creates black holes to destroy the Federation one planet at a time.,J.J. Abrams,"['Chris Pine', 'Zachary Quinto', 'Simon Pegg', 'Leonard Nimoy']"
516,In Bruges,(2008),107 min,7.9,67        ,R,"406,067",$7.76M,"Guilt-stricken after a job gone wrong, hitman Ray and his partner await orders from their ruthless boss in Bruges, Belgium, the last place in the world Ray wants to be.",Martin McDonagh,"['Colin Farrell', 'Brendan Gleeson', 'Ciarán Hinds', 'Elizabeth Berrington']"
517,The Man from Earth,(2007),87 min,7.9,****,****,"181,988",%^%^%^,An impromptu goodbye party for Professor John Oldman becomes a mysterious interrogation after the retiring scholar reveals to his colleagues he has a longer and stranger past than they can imagine.,Richard Schenkman,"['David Lee Smith', 'Tony Todd', 'John Billingsley', 'Ellen Crawford']"
518,Letters from Iwo Jima,(2006),141 min,7.9,89        ,UA,"159,029",$13.76M,"The story of the battle of Iwo Jima between the United States and Imperial Japan during World War II, as told from the perspective of the Japanese who fought it.",Clint Eastwood,"['Ken Watanabe', 'Kazunari Ninomiya', 'Tsuyoshi Ihara', 'Ryô Kase']"
519,The Fall,(2006),117 min,7.9,64        ,R,"110,173",$2.28M,"In a hospital on the outskirts of 1920s Los Angeles, an injured stuntman begins to tell a fellow patient, a little girl with a broken arm, a fantastic story of five mythical heroes. Thanks to his fractured state of mind and her vivid imagination, the line between fiction and reality blurs as the tale advances.",Tarsem Singh,"['Lee Pace', 'Catinca Untaru', 'Justine Waddell', 'Kim Uylenbroek']"
520,Life of Pi,(2012),127 min,7.9,79        ,U,"604,489",$124.99M,"A young man who survives a disaster at sea is hurtled into an epic journey of adventure and discovery. While cast away, he forms an unexpected connection with another survivor: a fearsome Bengal tiger.",Ang Lee,"['Suraj Sharma', 'Irrfan Khan', 'Adil Hussain', 'Tabu']"
521,Fantastic Mr. Fox,(2009),87 min,7.9,83        ,U,"216,175",$21.00M,An urbane fox cannot resist returning to his farm raiding ways and then must help his community survive the farmers' retaliation.,Wes Anderson,"['George Clooney', 'Meryl Streep', 'Bill Murray', 'Jason Schwartzman']"
522,C.R.A.Z.Y.,(2005),129 min,7.9,81        ,Not Rated,"32,136",%^%^%^,"A young French Canadian, one of five boys in a conservative family in the 1960s and 1970s, struggles to reconcile his emerging identity with his father's values.",Jean-Marc Vallée,"['Michel Côté', 'Marc-André Grondin', 'Danielle Proulx', 'Émile Vallée']"
523,Les choristes,(2004),97 min,7.9,56        ,PG-13,"59,967",$3.64M,The new teacher at a severely administered boys' boarding school works to positively affect the students' lives through music.,Christophe Barratier,"['Gérard Jugnot', 'François Berléand', 'Jean-Baptiste Maunier', 'Kad Merad']"
524,Iron Man,(2008),126 min,7.9,79        ,UA,"994,307",$318.41M,"After being held captive in an Afghan cave, billionaire engineer Tony Stark creates a unique weaponized suit of armor to fight evil.",Jon Favreau,"['Robert Downey Jr.', 'Gwyneth Paltrow', 'Terrence Howard', 'Jeff Bridges']"
525,Shaun of the Dead,(2004),99 min,7.9,76        ,UA,"535,572",$13.54M,"The uneventful, aimless lives of a London electronics salesman and his layabout roommate are disrupted by the zombie apocalypse.",Edgar Wright,"['Simon Pegg', 'Nick Frost', 'Kate Ashfield', 'Lucy Davis']"
526,Kal Ho Naa Ho,(2003),186 min,7.9,54        ,U,"66,719",$1.79M,"Naina, an introverted, perpetually depressed girl's life changes when she meets Aman. But Aman has a secret of his own which changes their lives forever. Embroiled in all this is Rohit, Naina's best friend who conceals his love for her.",Nikkhil Advani,"['Preity Zinta', 'Shah Rukh Khan', 'Saif Ali Khan', 'Jaya Bachchan']"
527,Gegen die Wand,(2004),121 min,7.9,78        ,R,"53,091",%^%^%^,"With the intention to break free from the strict familial restrictions, a suicidal young woman sets up a marriage of convenience with a forty-year-old addict, an act that will lead to an outburst of envious love.",Fatih Akin,"['Birol Ünel', 'Sibel Kekilli', 'Güven Kiraç', 'Zarah Jane McKenzie']"
528,Mystic River,(2003),138 min,7.9,84        ,A,"440,343",$90.14M,The lives of three men who were childhood friends are shattered when one of them has a family tragedy.,Clint Eastwood,"['Sean Penn', 'Tim Robbins', 'Kevin Bacon', 'Emmy Rossum']"
529,Harry Potter and the Prisoner of Azkaban,(2004),142 min,7.9,82        ,U,"587,471",$249.36M,"Harry Potter, Ron and Hermione return to Hogwarts School of Witchcraft and Wizardry for their third year of study, where they delve into the mystery surrounding an escaped prisoner who poses a dangerous threat to the young wizard.",Alfonso Cuarón,"['Daniel Radcliffe', 'Emma Watson', 'Rupert Grint', 'Richard Griffiths']"
530,Ying xiong,(2002),120 min,7.9,85        ,UA,"178,334",$53.71M,"A defense officer, Nameless, was summoned by the King of Qin regarding his success of terminating three warriors.",Yimou Zhang,"['Jet Li', 'Tony Chiu-Wai Leung', 'Maggie Cheung', 'Ziyi Zhang']"
531,Sennen joyû,(2001),87 min,7.9,70        ,PG,"26,046",$0.19M,A TV interviewer and his cameraman meet a former actress and travel through her memories and career.,Satoshi Kon,"['Miyoko Shôji', 'Shôzô Îzuka', 'Mami Koyama', 'Fumiko Orikasa']"
532,Hable con ella,(2002),112 min,7.9,86        ,R,"109,372",$9.28M,Two men share an odd friendship while they care for two women who are both in deep comas.,Pedro Almodóvar,"['Rosario Flores', 'Javier Cámara', 'Darío Grandinetti', 'Leonor Watling']"
533,No Man's Land,(I) (2001),98 min,7.9,84        ,R,"46,239",$1.06M,"Bosnia and Herzegovina during 1993 at the time of the heaviest fighting between the two warring sides. Two soldiers from opposing sides in the conflict, Nino and Ciki, become trapped in no man's land, whilst a third soldier becomes a living booby trap.",Danis Tanovic,"['Branko Djuric', 'Rene Bitorajac', 'Filip Sovagovic', 'Georges Siatidis']"
534,Cowboy Bebop: Tengoku no tobira,(2001),115 min,7.9,61        ,U,"46,206",$1.00M,"A terrorist explosion releases a deadly virus on the masses, and it's up the bounty-hunting Bebop crew to catch the cold-blooded culprit.","Directors:Shin'ichirô Watanabe, Tensai Okamura, Hiroyuki Okiura, Yoshiyuki Takei","['Beau Billingslea', 'Melissa Fahn', 'Nicholas Guest', 'Kôichi Yamadera']"
535,The Bourne Identity,(2002),119 min,7.9,68        ,UA,"527,889",$121.66M,"A man is picked up by a fishing boat, bullet-riddled and suffering from amnesia, before racing to elude assassins and attempting to regain his memory.",Doug Liman,"['Franka Potente', 'Matt Damon', 'Chris Cooper', 'Clive Owen']"
536,Nueve reinas,(2000),114 min,7.9,80        ,R,"51,644",$1.22M,"Two con artists try to swindle a stamp collector by selling him a sheet of counterfeit rare stamps (the ""nine queens"").",Fabián Bielinsky,"['Ricardo Darín', 'Gastón Pauls', 'Graciela Tenenbaum', 'María Mercedes Villagra']"
537,Children of Men,(2006),109 min,7.9,84        ,A,"483,024",$35.55M,"In 2027, in a chaotic world in which women have become somehow infertile, a former activist agrees to help transport a miraculously pregnant woman to a sanctuary at sea.",Alfonso Cuarón,"['Julianne Moore', 'Clive Owen', 'Chiwetel Ejiofor', 'Michael Caine']"
538,Todo sobre mi madre,(1999),101 min,7.9,87        ,R,"93,575",$8.26M,"Young Esteban wants to become a writer and also to discover the identity of his second mother, a trans woman, carefully concealed by his mother Manuela.",Pedro Almodóvar,"['Cecilia Roth', 'Marisa Paredes', 'Candela Peña', 'Antonia San Juan']"
539,Almost Famous,(2000),122 min,7.9,90        ,A,"266,846",$32.53M,A high-school boy in the early 1970s is given the chance to write a story for Rolling Stone magazine about an up-and-coming rock band as he accompanies them on their concert tour.,Cameron Crowe,"['Billy Crudup', 'Patrick Fugit', 'Kate Hudson', 'Frances McDormand']"
540,Mulholland Dr.,(2001),147 min,7.9,85        ,UA,"340,522",$7.22M,"After a car wreck on the winding Mulholland Drive renders a woman amnesiac, she and a perky Hollywood-hopeful search for clues and answers across Los Angeles in a twisting venture beyond dreams and reality.",David Lynch,"['Naomi Watts', 'Laura Harring', 'Justin Theroux', 'Jeanne Bates']"
541,Shrek,(2001),90 min,7.9,84        ,U,"643,503",$267.67M,"A mean lord exiles fairytale creatures to the swamp of a grumpy ogre, who must go on a quest and rescue a princess for the lord in order to get his land back.","Directors:Andrew Adamson, Vicky Jenson","['Mike Myers', 'Eddie Murphy', 'Cameron Diaz', 'John Lithgow']"
542,Toy Story 2,(1999),92 min,7.9,88        ,U,"552,806",$245.85M,"When Woody is stolen by a toy collector, Buzz and his friends set out on a rescue mission to save Woody before he becomes a museum toy property with his roundup gang Jessie, Prospector, and Bullseye.","Directors:John Lasseter, Ash Brannon, Lee Unkrich","['Tom Hanks', 'Tim Allen', 'Joan Cusack', 'Kelsey Grammer']"
543,Knockin' on Heaven's Door,(1997),87 min,7.9,****,****,"29,216",$0.00M,"Two terminally ill patients escape from a hospital, steal a car and rush towards the sea.",Thomas Jahn,"['Til Schweiger', 'Jan Josef Liefers', 'Thierry van Werveke', 'Moritz Bleibtreu']"
544,Boogie Nights,(1997),155 min,7.9,85        ,18,"252,548",$26.40M,"Back when sex was safe, pleasure was a business and business was booming, an idealistic porn producer aspires to elevate his craft to an art when he discovers a hot young talent.",Paul Thomas Anderson,"['Mark Wahlberg', 'Julianne Moore', 'Burt Reynolds', 'Luis Guzmán']"
545,Mimi wo sumaseba,(1995),111 min,7.9,75        ,U,"57,884",%^%^%^,"A love story between a girl who loves reading books, and a boy who has previously checked out all of the library books she chooses.",Yoshifumi Kondô,"['Yoko Honna', 'Issey Takahashi', 'Takashi Tachibana', 'Shigeru Muroi']"
546,Once Were Warriors,(1994),102 min,7.9,77        ,A,"33,012",$2.20M,A family descended from Maori warriors is bedeviled by a violent father and the societal problems of being treated as outcasts.,Lee Tamahori,"['Rena Owen', 'Temuera Morrison', 'Mamaengaroa Kerr-Bell', 'Julian Arahanga']"
547,True Romance,(1993),119 min,7.9,59        ,A,"218,653",$12.28M,"In Detroit, a lonely pop culture geek marries a call girl, steals cocaine from her pimp, and tries to sell it in Hollywood. Meanwhile, the owners of the cocaine, the Mob, track them down in an attempt to reclaim it.",Tony Scott,"['Christian Slater', 'Patricia Arquette', 'Dennis Hopper', 'Val Kilmer']"
548,Trois couleurs: Bleu,(1993),94 min,7.9,85        ,U,"97,377",$1.32M,A woman struggles to find a way to live her life after the death of her husband and child.,Krzysztof Kieslowski,"['Juliette Binoche', 'Zbigniew Zamachowski', 'Julie Delpy', 'Benoît Régent']"
549,Jûbê ninpûchô,(1993),94 min,7.9,****,A,"36,251",%^%^%^,A vagabond swordsman is aided by a beautiful ninja girl and a crafty spy in confronting a demonic clan of killers - with a ghost from his past as their leader - who are bent on overthrowing the Tokugawa Shogunate.,Yoshiaki Kawajiri,"['Kôichi Yamadera', 'Emi Shinohara', 'Takeshi Aono', 'Osamu Saka']"
550,Carlito's Way,(1993),144 min,7.9,65        ,A,"210,213",$36.95M,"A Puerto Rican former convict, just released from prison, pledges to stay away from drugs and violence despite the pressure around him and lead on to a better life outside of N.Y.C.",Brian De Palma,"['Al Pacino', 'Sean Penn', 'Penelope Ann Miller', 'John Leguizamo']"
551,Edward Scissorhands,(1990),105 min,7.9,74        ,U,"466,526",$56.36M,"An artificial man, who was incompletely constructed and has scissors for hands, leads a solitary life. Then one day, a suburban lady meets him and introduces him to her world.",Tim Burton,"['Johnny Depp', 'Winona Ryder', 'Dianne Wiest', 'Anthony Michael Hall']"
552,My Left Foot: The Story of Christy Brown,(1989),103 min,7.9,97        ,U,"71,836",$14.74M,"Christy Brown, born with cerebral palsy, learns to paint and write with his only controllable limb - his left foot.",Jim Sheridan,"['Daniel Day-Lewis', 'Brenda Fricker', 'Alison Whelan', 'Kirsten Sheridan']"
553,Majo no takkyûbin,(1989),103 min,7.9,83        ,U,"134,913",%^%^%^,"A young witch, on her mandatory year of independent life, finds fitting into a new community difficult while she supports herself by running an air courier service.",Hayao Miyazaki,"['Kirsten Dunst', 'Minami Takayama', 'Rei Sakuma', 'Kappei Yamaguchi']"
554,Crimes and Misdemeanors,(1989),104 min,7.9,77        ,****,"56,782",$18.25M,An ophthalmologist's mistress threatens to reveal their affair to his wife while a married documentary filmmaker is infatuated with another woman.,Woody Allen,"['Martin Landau', 'Woody Allen', 'Bill Bernstein', 'Claire Bloom']"
555,The Untouchables,(1987),119 min,7.9,79        ,A,"297,164",$76.27M,"During the era of Prohibition in the United States, Federal Agent Eliot Ness sets out to stop ruthless Chicago gangster Al Capone and, because of rampant corruption, assembles a small, hand-picked team to help him.",Brian De Palma,"['Kevin Costner', 'Sean Connery', 'Robert De Niro', 'Charles Martin Smith']"
556,Hannah and Her Sisters,(1986),107 min,7.9,90        ,****,"69,878",$40.08M,"Between two Thanksgivings two years apart, Hannah's husband falls in love with her sister Lee, while her hypochondriac ex-husband rekindles his relationship with her sister Holly.",Woody Allen,"['Mia Farrow', 'Dianne Wiest', 'Michael Caine', 'Barbara Hershey']"
557,Brazil,(1985),132 min,7.9,84        ,U,"195,880",$9.93M,A bureaucrat in a dystopic society becomes an enemy of the state as he pursues the woman of his dreams.,Terry Gilliam,"['Jonathan Pryce', 'Kim Greist', 'Robert De Niro', 'Katherine Helmond']"
558,This Is Spinal Tap,(1984),82 min,7.9,92        ,****,"135,606",$4.74M,"Spinal Tap, one of England's loudest bands, is chronicled by film director Marty DiBergi on what proves to be a fateful tour.",Rob Reiner,"['Rob Reiner', 'Michael McKean', 'Christopher Guest', 'Kimberly Stringer']"
559,A Christmas Story,(1983),93 min,7.9,77        ,U,"137,942",$20.61M,"In the 1940s, a young boy named Ralphie attempts to convince his parents, his teacher and Santa that a Red Ryder BB gun really is the perfect Christmas gift.",Bob Clark,"['Peter Billingsley', 'Melinda Dillon', 'Darren McGavin', 'Scott Schwartz']"
560,The Blues Brothers,(1980),133 min,7.9,60        ,U,"191,710",$57.23M,"Jake Blues rejoins with his brother Elwood after being released from prison, but the duo has just days to reunite their old R&B band and save the Catholic home where the two were raised, outrunning the police as they tear through Chicago.",John Landis,"['John Belushi', 'Dan Aykroyd', 'Cab Calloway', 'John Candy']"
561,Manhattan,(1979),96 min,7.9,83        ,****,"137,123",$45.70M,The life of a divorced television writer dating a teenage girl is further complicated when he falls in love with his best friend's mistress.,Woody Allen,"['Woody Allen', 'Diane Keaton', 'Mariel Hemingway', 'Michael Murphy']"
562,All That Jazz,(1979),123 min,7.9,72        ,A,"30,130",$37.82M,"Director/choreographer Bob Fosse tells his own life story as he details the sordid career of Joe Gideon, a womanizing, drug-using dancer.",Bob Fosse,"['Roy Scheider', 'Jessica Lange', 'Ann Reinking', 'Leland Palmer']"
563,Dawn of the Dead,(1978),127 min,7.9,71        ,A,"116,992",$5.10M,"Following an ever-growing epidemic of zombies that have risen from the dead, two Philadelphia S.W.A.T. team members, a traffic reporter, and his television executive girlfriend seek refuge in a secluded shopping mall.",George A. Romero,"['David Emge', 'Ken Foree', 'Scott H. Reiniger', 'Gaylen Ross']"
564,La montaña sagrada,(1973),114 min,7.9,76        ,A,"40,603",$0.06M,"In a corrupt, greed-fueled world, a powerful alchemist leads a messianic character and seven materialistic figures to the Holy Mountain, where they hope to achieve enlightenment.",Alejandro Jodorowsky,"['Alejandro Jodorowsky', 'Horacio Salinas', 'Zamira Saunders', 'Juan Ferrara']"
565,Amarcord,(1973),123 min,7.9,****,****,"42,113",$0.58M,A series of comedic and nostalgic vignettes set in a 1930s Italian coastal town.,Federico Fellini,"['Magali Noël', 'Bruno Zanin', 'Pupella Maggio', 'Armando Brancia']"
566,Le charme discret de la bourgeoisie,(1972),102 min,7.9,93        ,****,"41,392",$0.20M,"A surreal, virtually plotless series of dreams centered around six middle-class people and their consistently interrupted attempts to have a meal together.",Luis Buñuel,"['Fernando Rey', 'Delphine Seyrig', 'Paul Frankeur', 'Bulle Ogier']"
567,"Aguirre, der Zorn Gottes",(1972),95 min,7.9,****,****,"55,248",%^%^%^,"In the 16th century, the ruthless and insane Don Lope de Aguirre leads a Spanish expedition in search of El Dorado.",Werner Herzog,"['Klaus Kinski', 'Ruy Guerra', 'Helena Rojo', 'Del Negro']"
568,Harold and Maude,(1971),91 min,7.9,62        ,****,"75,370",%^%^%^,"Young, rich, and obsessed with death, Harold finds himself changed forever when he meets lively septuagenarian Maude at a funeral.",Hal Ashby,"['Ruth Gordon', 'Bud Cort', 'Vivian Pickles', 'Cyril Cusack']"
569,Patton,(1970),172 min,7.9,91        ,U,"99,266",$61.70M,The World War II phase of the career of controversial American general George S. Patton.,Franklin J. Schaffner,"['George C. Scott', 'Karl Malden', 'Stephen Young', 'Michael Strong']"
570,The Wild Bunch,(1969),145 min,7.9,97        ,A,"82,101",$12.06M,"An aging group of outlaws look for one last big score as the ""traditional"" American West is disappearing around them.",Sam Peckinpah,"['William Holden', 'Ernest Borgnine', 'Robert Ryan', ""Edmond O'Brien""]"
571,Night of the Living Dead,(1968),96 min,7.9,89        ,A,"123,689",$0.09M,A ragtag group of Pennsylvanians barricade themselves in an old farmhouse to remain safe from a horde of flesh-eating ghouls that are ravaging the East Coast of the United States.,George A. Romero,"['Duane Jones', ""Judith O'Dea"", 'Karl Hardman', 'Marilyn Eastman']"
572,The Lion in Winter,(1968),134 min,7.9,****,U,"30,526",$22.28M,"1183 A.D.: King Henry II's three sons all want to inherit the throne, but he won't commit to a choice. When he allows his imprisoned wife Eleanor of Aquitaine out for a Christmas visit, they all variously plot to force him into a decision.",Anthony Harvey,"[""Peter O'Toole"", 'Katharine Hepburn', 'Anthony Hopkins', 'John Castle']"
573,In the Heat of the Night,(1967),110 min,7.9,75        ,U,"71,406",$24.38M,"A black Philadelphia police detective is mistakenly suspected of a local murder while passing through a racially hostile Mississippi town, and after being cleared is reluctantly asked by the police chief to investigate the case.",Norman Jewison,"['Sidney Poitier', 'Rod Steiger', 'Warren Oates', 'Lee Grant']"
574,In Cold Blood,(1967),134 min,7.9,89        ,****,"25,689",%^%^%^,"Two ex-cons murder a family in a robbery attempt, before going on the run from the authorities. The police try to piece together the details of the murder in an attempt to track down the killers.",Richard Brooks,"['Robert Blake', 'Scott Wilson', 'John Forsythe', 'Paul Stewart']"
575,Charade,(1963),113 min,7.9,83        ,U,"73,734",$13.47M,Romance and suspense ensue in Paris as a woman is pursued by several men who want a fortune her murdered husband had stolen. Whom can she trust?,Stanley Donen,"['Cary Grant', 'Audrey Hepburn', 'Walter Matthau', 'James Coburn']"
