,Movie Name,Year of Release,Watch Time,Movie Rating,Metascore of movie,Certificate,Votes,Gross,Description,Director,Stars
245,No Country for Old Men,(2007),122 min,8.1,91        ,18,"911,442",$74.28M,Violence and mayhem ensue after a hunter stumbles upon a drug deal gone wrong and more than two million dollars in cash near the Rio Grande.,"Directors:Ethan Coen, Joel Coen","['Tommy Lee Jones', 'Javier Bardem', 'Josh Brolin', 'Woody Harrelson']"
246,Lage Raho Munna Bhai,(2006),144 min,8.1,****,U,"45,561",$2.22M,Munna Bhai embarks on a journey with Mahatma Gandhi in order to fight against a corrupt property dealer.,Rajkumar Hirani,"['Sanjay Dutt', 'Arshad Warsi', 'Vidya Balan', 'Boman Irani']"
247,V for Vendetta,(2005),132 min,8.1,62        ,UA,"1,076,510",$70.51M,"In a future British tyranny, a shadowy freedom fighter, known only by the alias of ""V,"" plots to overthrow it with the help of a young woman.",James McTeigue,"['Hugo Weaving', 'Natalie Portman', 'Rupert Graves', 'Stephen Rea']"
248,Dare mo shiranai,(2004),141 min,8.1,88        ,PG-13,"26,629",$0.68M,"In a small Tokyo apartment, twelve-year-old Akira must care for his younger siblings after their mother leaves them and shows no sign of returning.",Hirokazu Koreeda,"['Yûya Yagira', 'Ayu Kitaura', 'Hiei Kimura', 'Momoko Shimizu']"
249,Rang De Basanti,(2006),167 min,8.1,****,UA,"116,981",$2.20M,"The story of six young Indians who assist an English woman to film a documentary on the freedom fighters from their past, and the events that lead them to relive the long-forgotten saga of freedom.",Rakeysh Omprakash Mehra,"['Aamir Khan', 'Soha Ali Khan', 'Siddharth', 'Sharman Joshi']"
250,Million Dollar Baby,(2004),132 min,8.1,86        ,UA,"662,257",$100.49M,A determined woman works with a hardened boxing trainer to become a professional.,Clint Eastwood,"['Hilary Swank', 'Clint Eastwood', 'Morgan Freeman', 'Jay Baruchel']"
251,Hotel Rwanda,(2004),121 min,8.1,79        ,UA,"345,550",$23.53M,"Paul Rusesabagina, a hotel manager, houses over a thousand Tutsi refugees during their struggle against the Hutu militia in Rwanda, Africa.",Terry George,"['Don Cheadle', 'Sophie Okonedo', 'Joaquin Phoenix', 'Xolani Mali']"
252,Before Sunset,(2004),80 min,8.1,90        ,A,"250,285",$5.82M,"Nine years after Jesse and Celine first met, they encounter each other again on the French leg of Jesse's book tour.",Richard Linklater,"['Ethan Hawke', 'Julie Delpy', 'Vernon Dobtcheff', 'Louise Lemoine Torrès']"
253,Munna Bhai M.B.B.S.,(2003),156 min,8.1,****,U,"78,531",%^%^%^,A gangster sets out to fulfill his father's dream of becoming a doctor.,Rajkumar Hirani,"['Sanjay Dutt', 'Arshad Warsi', 'Gracy Singh', 'Boman Irani']"
254,Salinui chueok,(2003),131 min,8.1,82        ,UA,"162,890",$0.01M,"In a small Korean province in 1986, two detectives struggle with the case of multiple young women being found raped and murdered by an unknown culprit.",Bong Joon Ho,"['Kang-ho Song', 'Kim Sang-kyung', 'Roe-ha Kim', 'Jae-ho Song']"
255,Dil Chahta Hai,(2001),183 min,8.1,****,Unrated,"70,099",$0.30M,"Three inseparable childhood friends are just out of college. Nothing comes between them - until they each fall in love, and their wildly different approaches to relationships creates tension.",Farhan Akhtar,"['Aamir Khan', 'Saif Ali Khan', 'Akshaye Khanna', 'Preity Zinta']"
256,Kill Bill: Vol. 1,(2003),111 min,8.1,69        ,R,"1,056,284",$70.10M,"After awakening from a four-year coma, a former assassin wreaks vengeance on the team of assassins who betrayed her.",Quentin Tarantino,"['Uma Thurman', 'David Carradine', 'Daryl Hannah', 'Michael Madsen']"
257,Finding Nemo,(2003),100 min,8.1,90        ,U,"991,822",$380.84M,"After his son is captured in the Great Barrier Reef and taken to Sydney, a timid clownfish sets out on a journey to bring him home.","Directors:Andrew Stanton, Lee Unkrich","['Albert Brooks', 'Ellen DeGeneres', 'Alexander Gould', 'Willem Dafoe']"
258,Catch Me If You Can,(2002),141 min,8.1,75        ,A,"900,248",$164.62M,"Barely 21 yet, Frank is a skilled forger who has passed as a doctor, lawyer and pilot. FBI agent Carl becomes obsessed with tracking down the con man, who only revels in the pursuit.",Steven Spielberg,"['Leonardo DiCaprio', 'Tom Hanks', 'Christopher Walken', 'Martin Sheen']"
259,Amores perros,(2000),154 min,8.1,83        ,A,"233,429",$5.38M,"A horrific car accident connects three stories, each involving characters dealing with loss, regret, and life's harsh realities, all in the name of love.",Alejandro G. Iñárritu,"['Emilio Echevarría', 'Gael García Bernal', 'Goya Toledo', 'Álvaro Guerrero']"
260,"Monsters, Inc.",(2001),92 min,8.1,79        ,U,"858,598",$289.92M,"In order to power the city, monsters have to scare children so that they scream. However, the children are toxic to the monsters, and after a child gets through, two monsters realize things may not be what they think.","Directors:Pete Docter, David Silverman, Lee Unkrich","['Billy Crystal', 'John Goodman', 'Mary Gibbs', 'Steve Buscemi']"
261,"Shin seiki Evangelion Gekijô-ban: Air/Magokoro wo, kimi ni",(1997),87 min,8.1,****,Not Rated,"48,131",%^%^%^,Concurrent theatrical ending of the TV series Shin seiki evangerion (1995).,"Directors:Hideaki Anno, Kazuya Tsurumaki","['Megumi Ogata', 'Megumi Hayashibara', 'Yûko Miyamura', 'Kotono Mitsuishi']"
262,Lagaan: Once Upon a Time in India,(2001),224 min,8.1,84        ,U,"110,013",$0.07M,The people of a small village in Victorian India stake their future on a game of cricket against their ruthless British rulers.,Ashutosh Gowariker,"['Aamir Khan', 'Raghuvir Yadav', 'Gracy Singh', 'Rachel Shelley']"
263,The Sixth Sense,(1999),107 min,8.1,64        ,A,"949,129",$293.51M,"A frightened, withdrawn Philadelphia boy who communicates with spirits seeks the help of a disheartened child psychologist.",M. Night Shyamalan,"['Bruce Willis', 'Haley Joel Osment', 'Toni Collette', 'Olivia Williams']"
264,Festen,(1998),105 min,8.1,82        ,R,"84,055",$1.65M,"At Helge's 60th birthday party, some unpleasant family truths are revealed.",Thomas Vinterberg,"['Ulrich Thomsen', 'Henning Moritzen', 'Thomas Bo Larsen', 'Paprika Steen']"
265,La leggenda del pianista sull'oceano,(1998),169 min,8.1,58        ,U,"61,971",$0.26M,"A baby boy, discovered in 1900 on an ocean liner, grows into a musical prodigy, never setting foot on land.",Giuseppe Tornatore,"['Tim Roth', 'Pruitt Taylor Vince', 'Mélanie Thierry', 'Bill Nunn']"
266,The Truman Show,(1998),103 min,8.1,90        ,U,"1,000,697",$125.62M,An insurance salesman discovers his whole life is actually a reality TV show.,Peter Weir,"['Jim Carrey', 'Ed Harris', 'Laura Linney', 'Noah Emmerich']"
267,"Crna macka, beli macor",(1998),127 min,8.1,73        ,R,"52,651",$0.35M,Matko and his son Zare live on the banks of the Danube river and get by through hustling and basically doing anything to make a living. In order to pay off a business debt Matko agrees to marry off Zare to the sister of a local gangster.,Emir Kusturica,"['Bajram Severdzan', ""Srdjan 'Zika' Todorovic"", 'Branka Katic', 'Florijan Ajdini']"
268,The Big Lebowski,(1998),117 min,8.1,71        ,UA,"772,428",$17.50M,"Ultimate L.A. slacker Jeff ""The Dude"" Lebowski, mistaken for a millionaire of the same name, seeks restitution for a rug ruined by debt collectors, enlisting his bowling buddies for help while trying to find the millionaire's missing wife.","Directors:Joel Coen, Ethan Coen","['Jeff Bridges', 'John Goodman', 'Julianne Moore', 'Steve Buscemi']"
269,Fa Yeung Nin Wah,(2000),98 min,8.1,85        ,U,"138,991",$2.73M,"Two neighbors form a strong bond after both suspect extramarital activities of their spouses. However, they agree to keep their bond platonic so as not to commit similar wrongs.",Kar-Wai Wong,"['Tony Chiu-Wai Leung', 'Maggie Cheung', 'Siu Ping-Lam', ""Tung Cho 'Joe' Cheung""]"
270,Trainspotting,(1996),93 min,8.1,83        ,A,"660,744",$16.50M,"Renton, deeply immersed in the Edinburgh drug scene, tries to clean up and get out, despite the allure of the drugs and influence of friends.",Danny Boyle,"['Ewan McGregor', 'Ewen Bremner', 'Jonny Lee Miller', 'Kevin McKidd']"
271,Fargo,(1996),98 min,8.1,85        ,A,"648,470",$24.61M,Minnesota car salesman Jerry Lundegaard's inept crime falls apart due to his and his henchmen's bungling and the persistent police work of the quite pregnant Marge Gunderson.,"Directors:Joel Coen, Ethan Coen","['William H. Macy', 'Frances McDormand', 'Steve Buscemi', 'Peter Stormare']"
272,Underground,(1995),170 min,8.1,79        ,****,"57,235",$0.17M,"A group of Serbian socialists prepares for the war in a surreal underground filled by parties, tragedies, love and hate.",Emir Kusturica,"[""Predrag 'Miki' Manojlovic"", 'Lazar Ristovski', 'Mirjana Jokovic', 'Slavko Stimac']"
273,La haine,(1995),98 min,8.1,****,Not Rated,"162,214",$0.31M,24 hours in the lives of three young men in the French suburbs the day after a violent riot.,Mathieu Kassovitz,"['Vincent Cassel', 'Hubert Koundé', 'Saïd Taghmaoui', 'Abdel Ahmed Ghili']"
274,Dilwale Dulhania Le Jayenge,(1995),189 min,8.1,****,U,"66,919",%^%^%^,"When Raj meets Simran in Europe, it isn't love at first sight but when Simran moves to India for an arranged marriage, love makes its presence felt.",Aditya Chopra,"['Shah Rukh Khan', 'Kajol', 'Amrish Puri', 'Farida Jalal']"
275,Before Sunrise,(1995),101 min,8.1,77        ,16,"289,847",$5.54M,"A young man and woman meet on a train in Europe, and wind up spending one evening together in Vienna. Unfortunately, both know that this will probably be their only night together.",Richard Linklater,"['Ethan Hawke', 'Julie Delpy', 'Andrea Eckert', 'Hanno Pöschl']"
276,Trois couleurs: Rouge,(1994),99 min,8.1,100        ,U,"99,208",$4.04M,A model discovers a retired judge is keen on invading people's privacy.,Krzysztof Kieslowski,"['Irène Jacob', 'Jean-Louis Trintignant', 'Frédérique Feder', 'Jean-Pierre Lorit']"
277,Chung Hing sam lam,(1994),102 min,8.1,78        ,U,"73,283",$0.60M,"Two melancholy Hong Kong policemen fall in love: one with a mysterious female underworld figure, the other with a beautiful and ethereal waitress at a late-night restaurant he frequents.",Kar-Wai Wong,"['Brigitte Lin', 'Takeshi Kaneshiro', 'Tony Chiu-Wai Leung', 'Faye Wong']"
278,Andaz Apna Apna,(1994),160 min,8.1,****,U,"51,992",%^%^%^,Two slackers competing for the affections of an heiress inadvertently become her protectors from an evil criminal.,Rajkumar Santoshi,"['Aamir Khan', 'Salman Khan', 'Raveena Tandon', 'Karisma Kapoor']"
279,Jurassic Park,(1993),127 min,8.1,68        ,UA,"918,268",$402.45M,A pragmatic paleontologist touring an almost complete theme park on an island in Central America is tasked with protecting a couple of kids after a power failure causes the park's cloned dinosaurs to run loose.,Steven Spielberg,"['Sam Neill', 'Laura Dern', 'Jeff Goldblum', 'Richard Attenborough']"
280,In the Name of the Father,(1993),133 min,8.1,84        ,UA,"167,363",$25.01M,A man's coerced confession to an I.R.A. bombing he did not commit results in the imprisonment of his father as well. An English lawyer fights to free them.,Jim Sheridan,"['Daniel Day-Lewis', 'Pete Postlethwaite', 'Alison Crosbie', 'Philip King']"
281,Ba wang bie ji,(1993),171 min,8.1,83        ,R,"27,068",$5.22M,Two boys meet at an opera training school in Peking in 1924. Their resulting friendship will span nearly 70 years and will endure some of the most troublesome times in China's history.,Kaige Chen,"['Leslie Cheung', 'Fengyi Zhang', 'Gong Li', 'You Ge']"
282,Dà hóng denglong gaogao guà,(1991),125 min,8.1,****,****,"31,466",$2.60M,"A young woman becomes the fourth wife of a wealthy lord, and must learn to live with the strict rules and tensions within the household.",Yimou Zhang,"['Gong Li', 'Jingwu Ma', 'Saifei He', 'Cuifen Cao']"
283,Dead Poets Society,(1989),128 min,8.1,79        ,U,"454,691",$95.86M,Maverick teacher John Keating uses poetry to embolden his boarding school students to new heights of self-expression.,Peter Weir,"['Robin Williams', 'Robert Sean Leonard', 'Ethan Hawke', 'Josh Charles']"
284,The Princess Bride,(1987),98 min,8.1,77        ,U,"412,213",$30.86M,"While homesick in bed, a young boy's grandfather reads him the story of a farmboy-turned-pirate who encounters numerous obstacles, enemies and allies in his quest to be reunited with his true love.",Rob Reiner,"['Cary Elwes', 'Mandy Patinkin', 'Robin Wright', 'Chris Sarandon']"
285,Stand by Me,(1986),89 min,8.1,75        ,UA,"383,046",$52.29M,"After the death of one of his friends, a writer recounts a childhood journey with his friends to find the body of a missing boy.",Rob Reiner,"['Wil Wheaton', 'River Phoenix', 'Corey Feldman', ""Jerry O'Connell""]"
286,Platoon,(1986),120 min,8.1,92        ,UA,"398,006",$138.53M,"Chris Taylor, a neophyte recruit in Vietnam, finds himself caught in a battle of wills between two sergeants, one good and the other evil. A shrewd examination of the brutality of war and the duality of man in conflict.",Oliver Stone,"['Charlie Sheen', 'Tom Berenger', 'Willem Dafoe', 'Keith David']"
287,"Paris, Texas",(1984),145 min,8.1,78        ,U,"100,576",$2.18M,"Travis Henderson, an aimless drifter who has been missing for four years, wanders out of the desert and must reconnect with society, himself, his life, and his family.",Wim Wenders,"['Harry Dean Stanton', 'Nastassja Kinski', 'Dean Stockwell', 'Sam Berry']"
288,Kaze no tani no Naushika,(1984),117 min,8.1,86        ,U,"161,721",$0.50M,Warrior and pacifist Princess Nausicaä desperately struggles to prevent two warring nations from destroying themselves and their dying planet.,Hayao Miyazaki,"['Sumi Shimamoto', 'Mahito Tsujimura', 'Hisako Kyôda', 'Gorô Naya']"
289,Nostalgia,(1983),125 min,8.1,****,****,"25,727",$0.01M,"A Russian poet and his interpreter travel to Italy researching the life of an 18th-century composer, and instead meet a ruminative madman who tells the poet how the world may be saved.",Andrei Tarkovsky,"['Oleg Yankovskiy', 'Erland Josephson', 'Domiziana Giordano', 'Patrizia Terreno']"
290,The Thing,(1982),109 min,8.1,57        ,A,"397,819",$13.78M,A research team in Antarctica is hunted by a shape-shifting alien that assumes the appearance of its victims.,John Carpenter,"['Kurt Russell', 'Wilford Brimley', 'Keith David', 'Richard Masur']"
291,Fitzcarraldo,(1982),158 min,8.1,****,****,"33,681",%^%^%^,"The story of Brian Sweeney Fitzgerald, an extremely determined man who intends to build an opera house in the middle of a jungle.",Werner Herzog,"['Klaus Kinski', 'Claudia Cardinale', 'José Lewgoy', 'Miguel Ángel Fuentes']"
292,Fanny och Alexander,(1982),188 min,8.1,100        ,A,"61,458",$4.97M,"Two young Swedish children in the 1900s experience the many comedies and tragedies of their lively and affectionate theatrical family, the Ekdahls.",Ingmar Bergman,"['Bertil Guve', 'Pernilla Allwin', 'Kristina Adolphson', 'Börje Ahlstedt']"
293,Blade Runner,(1982),117 min,8.1,84        ,UA,"730,139",$32.87M,"A blade runner must pursue and terminate four replicants who stole a ship in space, and have returned to Earth to find their creator.",Ridley Scott,"['Harrison Ford', 'Rutger Hauer', 'Sean Young', 'Edward James Olmos']"
294,The Elephant Man,(1980),124 min,8.1,78        ,UA,"232,294",%^%^%^,"A Victorian surgeon rescues a heavily disfigured man who is mistreated while scraping a living as a side-show freak. Behind his monstrous façade, there is revealed a person of kindness, intelligence and sophistication.",David Lynch,"['Anthony Hopkins', 'John Hurt', 'Anne Bancroft', 'John Gielgud']"
295,Stalker,(1979),162 min,8.1,****,U,"127,756",$0.23M,A guide leads two men through an area known as the Zone to find a room that grants wishes.,Andrei Tarkovsky,"['Alisa Freyndlikh', 'Aleksandr Kaydanovskiy', 'Anatoliy Solonitsyn', 'Nikolay Grinko']"
296,Life of Brian,(1979),94 min,8.1,77        ,****,"384,417",$20.05M,"Born on the original Christmas in the stable next door to Jesus Christ, Brian of Nazareth spends his life being mistaken for a messiah.",Terry Jones,"['Graham Chapman', 'John Cleese', 'Michael Palin', 'Terry Gilliam']"
297,The Deer Hunter,(1978),183 min,8.1,86        ,A,"326,877",$48.98M,An in-depth examination of the ways in which the Vietnam War impacts and disrupts the lives of several friends in a small steel mill town in Pennsylvania.,Michael Cimino,"['Robert De Niro', 'Christopher Walken', 'John Cazale', 'John Savage']"
298,Rocky,(1976),120 min,8.1,70        ,U,"544,836",$117.24M,A small-time Philadelphia boxer gets a supremely rare chance to fight the world heavyweight champion in a bout in which he strives to go the distance for his self-respect.,John G. Avildsen,"['Sylvester Stallone', 'Talia Shire', 'Burt Young', 'Carl Weathers']"
299,Network,(1976),121 min,8.1,83        ,UA,"153,458",%^%^%^,"A television network cynically exploits a deranged former anchor's ravings and revelations about the news media for its own profit, but finds that his message may be difficult to control.",Sidney Lumet,"['Faye Dunaway', 'William Holden', 'Peter Finch', 'Robert Duvall']"
300,Barry Lyndon,(1975),185 min,8.1,89        ,U,"159,942",%^%^%^,An Irish rogue wins the heart of a rich widow and assumes her dead husband's aristocratic position in 18th-century England.,Stanley Kubrick,"[""Ryan O'Neal"", 'Marisa Berenson', 'Patrick Magee', 'Hardy Krüger']"
301,Zerkalo,(1975),107 min,8.1,80        ,****,"44,017",$0.18M,"A dying man in his forties remembers his past. His childhood, his mother, the war, personal moments and things that tell of the recent history of all the Russian nation.",Andrei Tarkovsky,"['Margarita Terekhova', 'Filipp Yankovskiy', 'Ignat Daniltsev', 'Oleg Yankovskiy']"
302,Paper Moon,(1973),102 min,8.1,77        ,U,"45,017",$30.93M,"During the Great Depression, a con man finds himself saddled with a young girl who may or may not be his daughter, and the two forge an unlikely partnership.",Peter Bogdanovich,"[""Ryan O'Neal"", ""Tatum O'Neal"", 'Madeline Kahn', 'John Hillerman']"
303,Viskningar och rop,(1972),91 min,8.1,****,A,"32,714",$1.74M,"When a woman dying of cancer in early twentieth-century Sweden is visited by her two sisters, long-repressed feelings between the siblings rise to the surface.",Ingmar Bergman,"['Harriet Andersson', 'Liv Ullmann', 'Kari Sylwan', 'Ingrid Thulin']"
304,Le samouraï,(1967),105 min,8.1,****,****,"48,972",$0.04M,After professional hitman Jef Costello is seen by witnesses his efforts to provide himself an alibi drive him further into a corner.,Jean-Pierre Melville,"['Alain Delon', 'François Périer', 'Nathalie Delon', 'Cathy Rosier']"
305,Cool Hand Luke,(1967),127 min,8.1,92        ,A,"171,245",$16.22M,"A laid back Southern man is sentenced to two years in a rural prison, but refuses to conform.",Stuart Rosenberg,"['Paul Newman', 'George Kennedy', 'Strother Martin', 'J.D. Cannon']"
306,Persona,(1966),85 min,8.1,86        ,****,"112,074",%^%^%^,A nurse is put in charge of a mute actress and finds that their personae are melding together.,Ingmar Bergman,"['Bibi Andersson', 'Liv Ullmann', 'Margaretha Krook', 'Gunnar Björnstrand']"
307,Andrei Rublev,(1966),205 min,8.1,****,****,"51,445",$0.10M,"The life, times and afflictions of the fifteenth-century Russian iconographer St. Andrei Rublev.",Andrei Tarkovsky,"['Anatoliy Solonitsyn', 'Ivan Lapikov', 'Nikolay Grinko', 'Nikolay Sergeev']"
308,La battaglia di Algeri,(1966),121 min,8.1,96        ,****,"57,428",$0.06M,"In the 1950s, fear and violence escalate as the people of Algiers fight for independence from the French government.",Gillo Pontecorvo,"['Brahim Hadjadj', 'Jean Martin', 'Yacef Saadi', 'Samia Kerbash']"
309,El ángel exterminador,(1962),95 min,8.1,****,****,"32,116",%^%^%^,The guests at an upper-class dinner party find themselves unable to leave.,Luis Buñuel,"['Silvia Pinal', 'Jacqueline Andere', 'Enrique Rambal', 'José Baviera']"
310,What Ever Happened to Baby Jane?,(1962),134 min,8.1,75        ,A,"53,456",$4.05M,A former child star torments her paraplegic sister in their decaying Hollywood mansion.,Robert Aldrich,"['Bette Davis', 'Joan Crawford', 'Victor Buono', 'Wesley Addy']"
311,Sanjuro,(1962),96 min,8.1,****,U,"36,934",%^%^%^,"A crafty samurai helps a young man and his fellow clansmen trying to save his uncle, who has been framed and imprisoned by a corrupt superintendent.",Akira Kurosawa,"['Toshirô Mifune', 'Tatsuya Nakadai', 'Keiju Kobayashi', 'Yûnosuke Itô']"
312,The Man Who Shot Liberty Valance,(1962),123 min,8.1,94        ,U,"73,204",%^%^%^,A senator returns to a western town for the funeral of an old friend and tells the story of his origins.,John Ford,"['James Stewart', 'John Wayne', 'Vera Miles', 'Lee Marvin']"
313,Ivanovo detstvo,(1962),95 min,8.1,****,A,"34,739",%^%^%^,"During WWII, Soviet orphan Ivan Bondarev strikes up a friendship with three sympathetic Soviet officers while working as a scout behind the German lines.","Directors:Andrei Tarkovsky, Eduard Abalov","['Nikolay Burlyaev', 'Valentin Zubkov', 'Evgeniy Zharikov', 'Stepan Krylov']"
314,Jungfrukällan,(1960),89 min,8.1,****,A,"28,262",$1.53M,"In 14th-century Sweden, an innocent yet pampered teenage girl and her family's pregnant and jealous servant set out from their farm to deliver candles to church, but only one returns from events that transpire in the woods along the way.",Ingmar Bergman,"['Max von Sydow', 'Birgitta Valberg', 'Gunnel Lindblom', 'Birgitta Pettersson']"
315,Inherit the Wind,(1960),128 min,8.1,75        ,****,"29,231",%^%^%^,"Based on a real-life case in 1925, two great lawyers argue the case for and against a Tennessee science teacher accused of the crime of teaching evolution.",Stanley Kramer,"['Spencer Tracy', 'Fredric March', 'Gene Kelly', 'Dick York']"
316,Les quatre cents coups,(1959),99 min,8.1,****,U,"112,501",%^%^%^,"A young boy, left without attention, delves into a life of petty crime.",François Truffaut,"['Jean-Pierre Léaud', 'Albert Rémy', 'Claire Maurier', 'Guy Decomble']"
317,Ben-Hur,(1959),212 min,8.1,90        ,U,"230,114",$74.70M,"After a Jewish prince is betrayed and sent into slavery by a Roman friend in 1st-century Jerusalem, he regains his freedom and comes back for revenge.",William Wyler,"['Charlton Heston', 'Jack Hawkins', 'Stephen Boyd', 'Haya Harareet']"
318,Kakushi-toride no san-akunin,(1958),139 min,8.1,89        ,****,"37,598",%^%^%^,"Lured by gold, two greedy peasants unknowingly escort a princess and her general across enemy lines.",Akira Kurosawa,"['Toshirô Mifune', 'Misa Uehara', 'Minoru Chiaki', 'Kamatari Fujiwara']"
319,Le notti di Cabiria,(1957),110 min,8.1,****,****,"46,697",$0.75M,A waifish prostitute wanders the streets of Rome looking for true love but finds only heartbreak.,Federico Fellini,"['Giulietta Masina', 'François Périer', 'Franca Marzi', 'Dorian Gray']"
320,Kumonosu-jô,(1957),110 min,8.1,****,U,"50,211",%^%^%^,"A war-hardened general, egged on by his ambitious wife, works to fulfill a prophecy that he would become lord of Spider's Web Castle.",Akira Kurosawa,"['Toshirô Mifune', 'Minoru Chiaki', 'Isuzu Yamada', 'Takashi Shimura']"
321,The Bridge on the River Kwai,(1957),161 min,8.1,87        ,PG,"212,658",$44.91M,"British POWs are forced to build a railway bridge across the river Kwai for their Japanese captors in occupied Burma, not knowing that the allied forces are planning a daring commando raid through the jungle to destroy it.",David Lean,"['William Holden', 'Alec Guinness', 'Jack Hawkins', 'Sessue Hayakawa']"
322,Du rififi chez les hommes,(1955),118 min,8.1,97        ,****,"32,953",$0.06M,"Four men plan a technically perfect crime, but the human element intervenes...",Jules Dassin,"['Jean Servais', 'Carl Möhner', 'Robert Manuel', 'Janine Darcey']"
323,On the Waterfront,(1954),108 min,8.1,91        ,A,"149,572",$9.60M,"An ex-prize fighter turned New Jersey longshoreman struggles to stand up to his corrupt union bosses, including his older brother, as he starts to connect with the grieving sister of one of the syndicate's victims.",Elia Kazan,"['Marlon Brando', 'Karl Malden', 'Lee J. Cobb', 'Rod Steiger']"
324,Les diaboliques,(1955),117 min,8.1,****,****,"64,391",$1.09M,The wife and mistress of a loathed school principal plan to murder him with what they believe is the perfect alibi.,Henri-Georges Clouzot,"['Simone Signoret', 'Véra Clouzot', 'Paul Meurisse', 'Charles Vanel']"
325,Le salaire de la peur,(1953),131 min,8.1,85        ,U,"58,713",%^%^%^,"In a decrepit South American village, four men are hired to transport an urgent nitroglycerine shipment without the equipment that would make it safe.",Henri-Georges Clouzot,"['Yves Montand', 'Charles Vanel', 'Peter van Eyck', 'Folco Lulli']"
326,Ace in the Hole,(1951),111 min,8.1,72        ,****,"34,287",$3.97M,"A frustrated former big-city journalist now stuck working for an Albuquerque newspaper exploits a story about a man trapped in a cave to rekindle his career, but the situation quickly escalates into an out-of-control circus.",Billy Wilder,"['Kirk Douglas', 'Jan Sterling', 'Robert Arthur', 'Porter Hall']"
327,White Heat,(1949),114 min,8.1,****,****,"31,781",%^%^%^,A psychopathic criminal with a mother complex makes a daring break from prison and leads his old gang in a chemical plant payroll heist.,Raoul Walsh,"['James Cagney', 'Virginia Mayo', ""Edmond O'Brien"", 'Margaret Wycherly']"
328,The Third Man,(1949),104 min,8.1,97        ,U,"166,412",$0.45M,"Pulp novelist Holly Martins travels to shadowy, postwar Vienna, only to find himself investigating the mysterious death of an old friend, Harry Lime.",Carol Reed,"['Orson Welles', 'Joseph Cotten', 'Alida Valli', 'Trevor Howard']"
